issued,describedByType,systemOfRecords,references,landingPage,title,theme,spatial,programCode,describedBy,description,language,isPartOf,bureauCode,contactPoint,accessLevel,publisher,keyword,license,rights,modified,accrualPeriodicity,dataQuality,distribution,identifier2013-07-12,,,['http://www.ers.usda.gov/data-products/fertilizer-use-and-price.aspx'],,Fertilizer Use and Price,,United States,['005:041'],http://www.ers.usda.gov/data-products/fertilizer-use-and-price.aspx,"This product brings together 1960-2012 data on fertilizer consumption in the United States by plant nutrient and major selected product, as well as consumption of mixed fertilizers, secondary nutrients, and micronutrients. Share of crop area receiving fertilizer and fertilizer use per receiving acre, by nutrient, are presented for the major producing States for corn, cotton, soybeans, and wheat. Additional data include fertilizer farm prices and indices of wholesale fertilizer price. Fertilizer price data are through 2013.",,,['005:13'],"{'hasEmail': 'mailto:rnehring@ers.usda.gov', '@type': 'vcard:Contact', 'fn': 'Richard Nehring'}",public,"{'@type': 'org:Organization', 'name': 'Economic Research Service, Department of Agriculture'}","['Economic Research Service', 'United States', 'consumption', 'corn', 'cotton', 'farm pries', 'fertilizer', 'fertilizer price', 'indices', 'micronutrients', 'mixed fertilizers', 'nutrients', 'plant nutrient', 'soybeans', 'wheat', 'wholesale fertilizer']",https://creativecommons.org/publicdomain/zero/1.0/,,2014-03-19,R/P1Y,,"[{'downloadURL': 'http://www.ers.usda.gov/datafiles/Fertilizer_Use_and_Price/A_single_Excel_workbook_with_all_tables_in_multiple_worksheets/fertilizeruse.xls', 'mediaType': 'application/xls', '@type': 'dcat:Distribution', 'title': 'Data file'}]",USDA-ERS-04082
2013-12-05,,,['http://www.ers.usda.gov/data-products/food-access-research-atlas/about-the-atlas.aspx'],,Food Access Research Atlas,,United States,['005:041'],http://www.ers.usda.gov/data-products/food-access-research-atlas/documentation.aspx,"The Food Access Research Atlas presents a spatial overview of food access indicators for low-income and other census tracts using different measures of supermarket accessibility, provides food access data for populations within census tracts, and offers census-tract-level data on food access that can be downloaded for community planning or research purposes.",,,['005:13'],"{'hasEmail': 'mailto:sverploeg@ers.usda.gov', '@type': 'vcard:Contact', 'fn': 'Michele Ver Ploeg'}",public,"{'@type': 'org:Organization', 'name': 'Economic Research Service, Department of Agriculture'}","['affordable food', 'atlas', 'census tracts', 'food access', 'food deserts', 'low income', 'nutritious food']",https://creativecommons.org/publicdomain/zero/1.0/,,2015-01-29,R/P1Y,,"[{'downloadURL': 'http://www.ers.usda.gov/data-products/food-access-research-atlas/go-to-the-atlas.aspx', 'mediaType': 'text/html', '@type': 'dcat:Distribution', 'title': 'Interactive map'}, {'accessURL': 'http://gis.ers.usda.gov/arcgis/rest/services/', '@type': 'dcat:Distribution', 'format': 'API', 'description': 'See http://www.ers.usda.gov/developer/geospatial-apis.aspx for more information.', 'title': 'GIS API Services'}, {'downloadURL': 'http://www.ers.usda.gov/datafiles/Food_Access_Research_Atlas/Download_the_Data/Current_Version/DataDownload.xlsx', 'mediaType': 'application/xls', '@type': 'dcat:Distribution', 'title': 'Data file'}]",USDA-ERS-26131
2013-12-18,,,['http://www.ers.usda.gov/data-products/food-availability-(per-capita)-data-system/readings.aspx'],,Food Availability (Per Capita) Data System,,United States,['005:041'],http://www.ers.usda.gov/data-products/food-availability-(per-capita)-data-system/glossary.aspx,"The ERS Food Availability (Per Capita) Data System (FADS) includes three distinct but related data series on food and nutrient availability for consumption. The data serve as popular proxies for actual consumption at the national level. Food availability data are now updated through 2011, the most recent year available; these data are the foundation for the other two series. Loss-adjusted food availability data are also available through 2011 for most products but are preliminary estimates. Nutrient availability data are provided through 2006, as this data series has not yet been updated beyond 2006.",,,['005:13'],"{'hasEmail': 'mailto:jbuzby@ers.usda.gov', '@type': 'vcard:Contact', 'fn': 'Jean Buzby'}",public,"{'@type': 'org:Organization', 'name': 'Economic Research Service, Department of Agriculture'}","['Dietary Guidelines for Americans', 'ERS', 'Food Guide Pyramid servings data', 'USDA', 'agriculture', 'dietary recommendations', 'disappearance data', 'food availability', 'food consumption', 'food supply data', 'loss-adjusted food availability', 'nutrient availability', 'per capita']",https://creativecommons.org/publicdomain/zero/1.0/,,2014-03-19,R/P1Y,,"[{'downloadURL': 'http://www.ers.usda.gov/data-products/food-availability-(per-capita)-data-system.aspx', 'mediaType': 'application/xls', '@type': 'dcat:Distribution', 'title': 'Web page with links to Excel files'}]",USDA-ERS-00131
2011-06-15,,,['http://www.ers.usda.gov/data-products/food-consumption-and-nutrient-intakes/documentation.aspx'],,Food Consumption and Nutrient Intakes,,,['005:041'],,"Food consumption in terms of the Dietary Guidelines for Americans’ food groups is reported for all sources and the total U.S. population, as well as by food source, children age 2-19, and adults age 20 and older.",,,['005:13'],"{'hasEmail': 'mailto:blin@ers.usda.gov', '@type': 'vcard:Contact', 'fn': 'Biing-Hwan Lin'}",public,"{'@type': 'org:Organization', 'name': 'Economic Research Service, U.S. Department of Agriculture'}","['food consumption', 'nutrient']",https://creativecommons.org/publicdomain/zero/1.0/,,2014-03-19,,,"[{'downloadURL': 'http://www.ers.usda.gov/data-products/food-consumption-and-nutrient-intakes.aspx', 'mediaType': 'application/xls', '@type': 'dcat:Distribution', 'title': 'Web page with links to Excel files'}]",USDA-ERS-00068
2013-12-05,,,['http://www.ers.usda.gov/data-products/food-dollar-series/documentation.aspx'],,Food Dollar Series,,United States,['005:041'],http://www.ers.usda.gov/data-products/food-dollar-series/glossary.aspx,"The food dollar series measures annual expenditures by U.S. consumers on domestically produced food. This data series is composed of three primary series - the marketing bill series, the industry group series, and the primary factor series - that shed light on different aspects of the food supply chain. The three series show three different ways to split up the same food dollar.",,,['005:13'],"{'hasEmail': 'mailto:pcanning@ers.usda.gov', '@type': 'vcard:Contact', 'fn': 'Patrick Canning'}",public,"{'@type': 'org:Organization', 'name': 'Economic Research Service, Department of Agriculture'}","['farm share', 'food dollar', 'food dollar series', 'food marketing bill', 'industry value added', 'input-output analysis', 'primary factor value added', 'supply chain analysis', 'time-series data']",https://creativecommons.org/licenses/by/4.0,,2014-07-24,R/P1Y,,"[{'downloadURL': 'http://www.ers.usda.gov/data-products/food-dollar-series/food-dollar-application.aspx', 'mediaType': 'text/html', '@type': 'dcat:Distribution', 'title': 'Query tool'}, {'accessURL': 'http://www.ers.usda.gov/developer/data-apis.aspx', '@type': 'dcat:Distribution', 'format': 'API', 'description': 'See http://www.ers.usda.gov/developer/data-apis.aspx for more information.', 'title': 'Food Dollar API'}, {'downloadURL': 'http://www.ers.usda.gov/data-products/food-dollar-series/download-the-data.aspx', 'mediaType': 'text/html', '@type': 'dcat:Distribution', 'title': 'Food Dollar Series Data Download'}]",USDA-ERS-25981
2013-12-05,,,['http://www.ers.usda.gov/data-products/food-environment-atlas/about-the-atlas.aspx'],,Food Environment Atlas,,United States,['005:041'],http://www.ers.usda.gov/data-products/food-environment-atlas/data-access-and-documentation-downloads.aspx,"Food environment factors--such as store/restaurant proximity, food prices, food and nutrition assistance programs, and community characteristics--interact to influence food choices and diet quality. Research is beginning to document the complexity of these interactions, but more is needed to identify causal relationships and effective policy interventions. The objectives of the Atlas are
to assemble statistics on food environment indicators to stimulate research on the determinants of food choices and diet quality, and to provide a spatial overview of a community's ability to access healthy food and its success in doing so.",,,['005:13'],"{'hasEmail': 'mailto:breneman@ers.usda.gov', '@type': 'vcard:Contact', 'fn': 'Vince Breneman'}",public,"{'@type': 'org:Organization', 'name': 'Economic Research Service, Department of Agriculture'}","['food assistance', 'food security', 'food stores', 'grocery stores', 'health', 'local foods', 'obesity', 'physical activity levels', 'restaurants', 'socioeconomic characteristics', 'taxes']",https://creativecommons.org/licenses/by/4.0,,2015-01-29,R/P1Y,,"[{'downloadURL': 'http://www.ers.usda.gov/data-products/food-environment-atlas/go-to-the-atlas.aspx', 'mediaType': 'text/html', '@type': 'dcat:Distribution', 'title': 'Interactive map'}, {'accessURL': 'http://gis.ers.usda.gov/arcgis/rest/services/', '@type': 'dcat:Distribution', 'format': 'API', 'description': 'See http://www.ers.usda.gov/developer/geospatial-apis.aspx for more information', 'title': 'GIS API Services'}, {'downloadURL': 'http://www.ers.usda.gov/datafiles/Food_Environment_Atlas/Data_Access_and_Documentation_Downloads/Current_Version/DataDownload.xls', 'mediaType': 'application/xls', '@type': 'dcat:Distribution', 'title': 'Data file'}]",USDA-ERS-02033
2013-12-17,,,,,Food Expenditures,,,['005:041'],http://www.ers.usda.gov/data-products/food-expenditures/documentation.aspx,"The ERS Food Expenditure Series annually measures total U.S. food expenditures, including purchases by consumers, governments, businesses, and nonprofit organizations. The ERS Food Expenditure Series contributes to the analysis of U.S. food production and consumption by constructing a comprehensive measure of the total value of all food expenditures by final purchasers. This series annually measures total U.S. food expenditures, including purchases by consumers, governments, businesses, and nonprofit organizations. Because the term expenditure is often associated with household decisionmaking, it is important to recognize that ERS's series also includes nonhousehold purchases. For example, the series includes the dollar value of domestic food purchases by military personnel and their dependents at military commissary stores and exchanges, the value of commodities and food dollars donated by the Federal government to schools, and the value of food purchased by airlines for serving during flights.",,,['005:13'],"{'hasEmail': 'mailto:aclauson@ers.usda.gov', '@type': 'vcard:Contact', 'fn': 'Annette Clauson'}",public,"{'@type': 'org:Organization', 'name': 'Economic Research Service, U.S. Department of Agriculture'}","['agricultural economics', 'expenditures', 'food']",https://creativecommons.org/publicdomain/zero/1.0/,,2014-06-17,R/P1Y,,"[{'downloadURL': 'http://www.ers.usda.gov/data-products/food-expenditures.aspx', 'mediaType': 'application/xls', '@type': 'dcat:Distribution', 'title': 'Web page with links to Excel files'}]",USDA-ERS-00069
2013-12-23,,,['http://www.ers.usda.gov/data-products/food-price-outlook/summary-findings.aspx'],,Food Price Outlook,,United States,['005:041'],http://www.ers.usda.gov/data-products/food-price-outlook/documentation.aspx,"The Consumer Price Index (CPI) for food is a component of the all-items CPI. The CPI measures the average change over time in the prices paid by urban consumers for a representative market basket of consumer goods and services. While the all-items CPI measures the price changes for all consumer goods and services, including food, the CPI for food measures the changes in the retail prices of food items only.",,,['005:13'],"{'hasEmail': 'mailto:rvolpe@ers.usda.gov', '@type': 'vcard:Contact', 'fn': 'Richard Volpe'}",public,"{'@type': 'org:Organization', 'name': 'Economic Research Service, Department of Agriculture'}","['CPI', 'Consumer Price Index', 'food price inflation', 'food price outlook', 'food-at-home', 'food-away-from-home', 'grocery store', 'restaurant', 'retail food prices', 'wholesale food prices']",https://creativecommons.org/publicdomain/zero/1.0/,,2014-03-19,R/P1Y,,"[{'downloadURL': 'http://www.ers.usda.gov/data-products/food-price-outlook.aspx', 'mediaType': 'application/xls', '@type': 'dcat:Distribution', 'title': 'Web page with links to Excel files'}]",USDA-ERS-26001
2013-09-04,,,['http://www.ers.usda.gov/data-products/food-security-in-the-united-states/documentation.aspx'],,Food Security in the United States,,United States,['005:041'],http://www.ers.usda.gov/data-products/food-security-in-the-united-states/documentation.aspx,This data section provides information about publicly available national surveys that include questions from the U.S. Food Security Survey Module. Information on each survey and directions for accessing data files are available in the documentation.,,,['005:13'],"{'hasEmail': 'mailto:acjensen@ers.usda.gov', '@type': 'vcard:Contact', 'fn': 'Alisha Coleman-Jensen'}",public,"{'@type': 'org:Organization', 'name': 'Economic Research Service, Department of Agriculture'}","['CPS', 'Current Population Survey', 'ECLS', 'ECLS-K', 'Food security', 'PSID', 'Panel Study of Income Dynamics', 'SIPP', 'SPD', 'food assistance and nutrition programs', 'food insecurity', 'food security data', 'hunger']",https://creativecommons.org/publicdomain/zero/1.0/,,2014-03-19,R/P1Y,,"[{'downloadURL': 'http://www.ers.usda.gov/data-products/food-security-in-the-united-states.aspx', '@type': 'dcat:Distribution', 'description': 'Links to documents for data access', 'mediaType': 'text/html', 'title': 'Web Page'}]",USDA-ERS-26011
2013-10-28,,,['http://www.ers.usda.gov/data-products/food-and-nutrition-assistance-research-database.aspx'],,Food and Nutrition Assistance Research Database,,,['005:041'],,"ERS supports a broad spectrum of food and nutrition assistance research and has compiled an electronic database of over 900 peer-reviewed reports and articles based on ERS-supported research. The database is searchable by title, lead author, topic, year of publication, and data set analyzed.",,,['005:13'],"{'hasEmail': 'mailto:victoro@ers.usda.gov', '@type': 'vcard:Contact', 'fn': 'Victor Oliveira'}",public,"{'@type': 'org:Organization', 'name': 'Economic Research Service, U.S. Department of Agriculture'}","['agricultural economics', 'research dissemination']",https://creativecommons.org/publicdomain/zero/1.0/,,2014-03-19,R/P1Y,,"[{'downloadURL': 'http://www.ers.usda.gov/data-products/food-and-nutrition-assistance-research-database/research-reports-articles-database.aspx', 'mediaType': 'text/html', '@type': 'dcat:Distribution', 'title': 'Research Reports & Articles Database'}, {'downloadURL': 'http://www.ers.usda.gov/data-products/food-and-nutrition-assistance-research-database/extramural-project-database.aspx', 'mediaType': 'text/html', '@type': 'dcat:Distribution', 'title': 'Extramural Project Database'}, {'downloadURL': 'http://www.ers.usda.gov/data-products/food-and-nutrition-assistance-research-database/ridge-project-summaries.aspx', 'mediaType': 'text/html', '@type': 'dcat:Distribution', 'title': 'RIDGE Project Summaries'}]",USDA-ERS-00067
,,,['http://www.ers.usda.gov/data-products/foodaps-national-household-food-acquisition-and-purchase-survey/documentation.aspx'],,FoodAPS National Household Food Acquisition and Purchase Survey,,,['005:041'],,USDA's National Household Food Acquisition and Purchase Survey (FoodAPS) will provide unique and detailed data about household food choices that are not available from any other survey. FoodAPS is a nationally representative survey of household food purchases and acquisitions.,,,['005:13'],"{'hasEmail': 'mailto:jkirlin@ers.usda.gov', '@type': 'vcard:Contact', 'fn': 'John A. Kirlin'}",public,"{'@type': 'org:Organization', 'name': 'Economic Research Service, U.S. Department of Agriculture'}","['agricultural economics', 'food', 'purchases', 'survey']",https://creativecommons.org/publicdomain/zero/1.0/,,2014-06-17,,,"[{'downloadURL': 'http://www.ers.usda.gov/data-products/foodaps-national-household-food-acquisition-and-purchase-survey.aspx', 'mediaType': 'text/html', '@type': 'dcat:Distribution', 'title': 'Web page with links to documents'}]",USDA-ERS-00050
2013-12-05,,,['http://ers.usda.gov/data-products/foreign-agricultural-trade-of-the-united-states-(fatus)/questions-answers.aspx'],,Foreign Agricultural Trade of the United States (FATUS),,"World, United States",['005:041'],http://ers.usda.gov/data-products/foreign-agricultural-trade-of-the-united-states-(fatus)/questions-answers.aspx,"The Foreign Agricultural Trade of the United States (FATUS) data page provides U.S. agricultural exports and imports, volume and value, by country and by commodity.",,,['005:13'],"{'hasEmail': 'mailto:stephenm@ers.usda.gov', '@type': 'vcard:Contact', 'fn': 'Stephen MacDonald'}",public,"{'@type': 'org:Organization', 'name': 'Economic Research Service, Department of Agriculture'}","['FATUS', 'HTS', 'U S exports', 'U S imports', 'agricultural economics', 'agricultural trade', 'bulk', 'by commodity', 'by country', 'export destination', 'high-value', 'import source', 'merchandise trade', 'value']",https://creativecommons.org/publicdomain/zero/1.0/,,2014-03-19,R/P1M,,"[{'downloadURL': 'http://ers.usda.gov/data-products/foreign-agricultural-trade-of-the-united-states-(fatus).aspx', 'mediaType': 'application/xls', '@type': 'dcat:Distribution', 'title': 'Web page with links to Excel files'}]",USDA-ERS-26051
2012-06-01,,,,,Frontier and Remote Area Codes,,United States,['005:041'],http://www.ers.usda.gov/data-products/frontier-and-remote-area-codes/documentation.aspx,"Frontier and Remote Area (FAR) codes provide a statistically-based, nationally-consistent, and adjustable definition of territory in the U.S. characterized by low population density and high geographic remoteness.

To assist in providing policy-relevant information about conditions in sparsely settled, remote areas of the U.S. to public officials, researchers, and the general public, ERS has developed ZIP-code-level frontier and remote (FAR) area codes. The aim is not to provide a single definition. Instead, it is to meet the demand for a delineation that is both geographically detailed and adjustable within reasonable ranges, in order to be usefully applied in diverse research and policy contexts. This initial set, based on urban-rural data from the 2000 decennial census, provides four separate FAR definition levels, ranging from one that is relatively inclusive (18 million FAR residents) to one that is more restrictive (4.8 million FAR residents).",,,['005:13'],"{'hasEmail': 'mailto:jbc@ers.usda.gov', '@type': 'vcard:Contact', 'fn': 'John Cromartie'}",public,"{'@type': 'org:Organization', 'name': 'Economic Research Service, U.S. Department of Agriculture'}","['ZIP code', 'codes', 'maps', 'nonmetro', 'rural']",https://creativecommons.org/publicdomain/zero/1.0/,,2014-03-19,,,"[{'downloadURL': 'http://www.ers.usda.gov/datafiles/Frontier_and_Remote_Area_Codes/2000_Frontier_and_Remote_Area_Codes_Data_Files/FARCodesStateSummaryTables.xls', 'mediaType': 'application/xls', '@type': 'dcat:Distribution', 'title': 'State-level summary tables'}, {'downloadURL': 'http://www.ers.usda.gov/datafiles/Frontier_and_Remote_Area_Codes/2000_Frontier_and_Remote_Area_Codes_Data_Files/FARCodesZIPCodeData.xls', 'mediaType': 'application/xls', '@type': 'dcat:Distribution', 'title': 'ZIP-code-level FAR codes and related data'}, {'downloadURL': 'http://www.ers.usda.gov/datafiles/Frontier_and_Remote_Area_Codes/2000_Frontier_and_Remote_Area_Codes_Data_Files/farcodesmaps.pdf', 'mediaType': 'application/pdf', '@type': 'dcat:Distribution', 'title': 'FAR code maps'}]",USDA-ERS-00070
2013-11-20,,,['http://ers.usda.gov/data-products/fruit-and-tree-nut-data/documentation.aspx'],,Fruit and Tree Nut Data,,United States,['005:041'],http://ers.usda.gov/data-products/fruit-and-tree-nut-data/documentation.aspx,"Fruit and Tree Nut Data provide users with comprehensive statistics on fresh and processed fruits, melons, and tree nuts in the United States, as well as some global data for these sectors.  It harmonizes and integrates data from the ERS market outlook program with data collected by different Federal and international statistical agencies to facilitate analyses of economic performance over time and across domestic and foreign markets.",,,['005:13'],"{'hasEmail': 'mailto:acperez@ers.usda.gov', '@type': 'vcard:Contact', 'fn': 'Agnes Perez'}",public,"{'@type': 'org:Organization', 'name': 'Economic Research Service, Department of Agriculture'}","['fruit', 'melons', 'prices', 'production', 'trade', 'tree nuts']",https://creativecommons.org/publicdomain/zero/1.0/,,2014-03-19,R/P1M,,"[{'downloadURL': 'http://ers.usda.gov/data-products/fruit-and-tree-nut-data/data-by-category.aspx', 'mediaType': 'text/html', '@type': 'dcat:Distribution', 'title': 'Query tool'}, {'downloadURL': 'http://ers.usda.gov/data-products/fruit-and-tree-nut-data/yearbook-tables.aspx', 'mediaType': 'application/xls', '@type': 'dcat:Distribution', 'title': 'Web page links to Excel files'}]",USDA-ERS-26141
2011-02-07,,,,,Fruit and Vegetable Prices,,,['005:041'],http://www.ers.usda.gov/data-products/fruit-and-vegetable-prices/documentation.aspx,How much do fruits and vegetables cost? ERS estimated average prices for 153 commonly consumed fresh and processed fruits and vegetables.,,,['005:13'],"{'hasEmail': 'mailto:hstewart@ers.usda.gov', '@type': 'vcard:Contact', 'fn': 'Hayden Stewart'}",public,"{'@type': 'org:Organization', 'name': 'Economic Research Service, U.S. Department of Agriculture'}","['agricultural economics', 'food costs']",https://creativecommons.org/publicdomain/zero/1.0/,,2014-03-19,,,"[{'downloadURL': 'http://www.ers.usda.gov/data-products/fruit-and-vegetable-prices.aspx', 'mediaType': 'application/xls', '@type': 'dcat:Distribution', 'title': 'Web page with links to Excel files'}]",USDA-ERS-00071
2013-12-11,,,['http://gis.ers.usda.gov/arcgis/sdk/rest/index.html?catalog.html'],http://www.ers.usda.gov/developer/geospatial-apis.aspx,GIS Map Services and API User Guide,,United States,['005:041'],,"All of the ERS mapping applications, such as the Food Environment Atlas and the Food Access Research Atlas, use map services developed and hosted by ERS as the source for their map content. These map services are open and freely available for use outside of the ERS map applications. Developers can include ERS maps in applications through the use of the map service REST API, and desktop GIS users can use the maps by connecting to the map server directly. Over 30 ERS map services have been created, each containing anywhere from 4 to 70 map layers. The majority of the services consist of national maps displaying data at the county-level.",,,['005:13'],"{'hasEmail': 'mailto:dnulph@ers.usda.gov', '@type': 'vcard:Contact', 'fn': 'David Nulph'}",public,"{'@type': 'org:Organization', 'name': 'Economic Research Service, U.S. Department of Agriculture'}","['APIs', 'ArcGIS', 'GIS', 'REST']",https://creativecommons.org/publicdomain/zero/1.0/,,2015-01-29,,,"[{'accessURL': 'http://gis.ers.usda.gov/arcgis/rest/', 'format': 'API', '@type': 'dcat:Distribution', 'title': 'ArcGIS REST Services Directory'}]",USDA-ERS-00097
2013-11-05,,,,,International Agricultural Productivity,,,['005:041'],http://www.ers.usda.gov/data-products/international-agricultural-productivity/documentation-and-methods.aspx,"This data product provides agricultural output, input and total factor productivity (TFP) growth rates, but not levels, across the countries and regions of the world in a consistent, comparable way, for 1961-2010.",,,['005:13'],"{'hasEmail': 'mailto:kfuglie@ers.usda.gov', '@type': 'vcard:Contact', 'fn': 'Keith Fuglie'}",public,"{'@type': 'org:Organization', 'name': 'Economic Research Service, U.S. Department of Agriculture'}","['agricultural economics', 'agricultural productivity']",https://creativecommons.org/publicdomain/zero/1.0/,,2014-03-19,,,"[{'downloadURL': 'http://www.ers.usda.gov/dataFiles/Internationalproductivity/AgTFPindividualcountries.xlsx', 'mediaType': 'application/xls', '@type': 'dcat:Distribution', 'title': 'Countries - Agricultural total factor productivity growth indices for countries, 1961-2010'}, {'downloadURL': 'http://www.ers.usda.gov/dataFiles/Internationalproductivity/AgTFPcountrygeographicgroups.xlsx', 'mediaType': 'application/xls', '@type': 'dcat:Distribution', 'title': 'Global regions - Agricultural total factor productivity growth indices for regions, 1961-2010'}, {'downloadURL': 'http://www.ers.usda.gov/dataFiles/Internationalproductivity/AgTFPcountryincomegroups.xlsx', 'mediaType': 'application/xml', '@type': 'dcat:Distribution', 'title': 'Income Groups - Agricultural total factor productivity growth indices for income groups, 1961-2010'}]",USDA-ERS-00072
