issued,describedByType,systemOfRecords,references,landingPage,title,theme,spatial,programCode,describedBy,description,language,isPartOf,bureauCode,contactPoint,accessLevel,publisher,keyword,license,rights,modified,accrualPeriodicity,dataQuality,distribution,identifier,,,,http://apps.fs.fed.us/ArcX/rest/services/EDW/EDW_ProclaimedForestsAndGrasslands_01/MapServer,U.S. Forest Service Original Proclaimed National Forests and National Grasslands,['geospatial'],,['005:000'],,"A map service on the www depicting the boundaries encompassing the National Forest System (NFS) lands within the original proclaimed National Forests, along with subsequent Executive Orders, Proclamations, Public Laws, Public Land Orders, Secretary of Agriculture Orders, and Secretary of Interior Orders creating modifications thereto, along with lands added to the NFS which have taken on the status of 'reserved from the public domain' under the General Exchange Act. The following area types are included: National Forest, Experimental Area, Experimental Forest, Experimental Range, Land Utilization Project, National Grassland, Purchase Unit, and Special Management Area. This map service also depicts National Grassland units designated by the Secretary of Agriculture and permanently held by the Department of Agriculture under Title III of the Bankhead-Jones Farm Tenant Act. This map service provides display, identification, and analysis tools for determining current boundary information for Forest Service managers, GIS Specialists, and others.",,,['005:96'],"{'hasEmail': 'mailto:data@fs.fed.us', '@type': 'vcard:Contact', 'fn': 'Dave Green'}",public,"{'@type': 'org:Organization', 'name': 'US Forest Service, Department of Agriculture'}","['forests', 'grasslands', 'land status', 'nfs lands', 'usfs']",https://creativecommons.org/publicdomain/zero/1.0/,,2014-08-01,,True,"[{'description': ""A map service on the www depicting the boundaries encompassing the National Forest System (NFS) lands within the original proclaimed National Forests, along with subsequent Executive Orders, Proclamations, Public Laws, Public Land Orders, Secretary of Agriculture Orders, and Secretary of Interior Orders creating modifications thereto, along with lands added to the NFS which have taken on the status of 'reserved from the public domain' under the General Exchange Act. The following area types are included: National Forest, Experimental Area, Experimental Forest, Experimental Range, Land Utilization Project, National Grassland, Purchase Unit, and Special Management Area. This map service also depicts National Grassland units designated by the Secretary of Agriculture and permanently held by the Department of Agriculture under Title III of the Bankhead-Jones Farm Tenant Act. This map service provides display, identification, and analysis tools for determining current boundary information for Forest Service managers, GIS Specialists, and others."", 'format': 'ArcGIS Map Service', 'title': 'U.S. Forest Service Original Proclaimed National Forests and National Grasslands', 'mediaType': 'text/html', 'downloadURL': 'http://apps.fs.usda.gov/ArcX/rest/services/EDW/EDW_ProclaimedForestsAndGrasslands_01/MapServer', '@type': 'dcat:Distribution'}, {'description': 'ArcGIS Feature Service', 'format': 'ArcGIS Feature Service', 'title': 'U.S. Forest Service Original Proclaimed National Forests and National Grasslands', 'mediaType': 'text/html', 'downloadURL': 'http://apps.fs.usda.gov/arcx/rest/services/EDW_FEATURE/EDW_ProclaimedForestsAndGrasslands_01/FeatureServer', '@type': 'dcat:Distribution'}, {'accessURL': 'http://apps.fs.usda.gov/ArcX/rest/services/EDW/EDW_ProclaimedForestsAndGrasslands_01/MapServer', '@type': 'dcat:Distribution', 'format': 'API', 'description': 'Link to API', 'title': 'API'}, {'downloadURL': 'http://data.fs.usda.gov/geodata/edw/edw_resources/meta/S_USA.ProclaimedForest_Grassland.xml', '@type': 'dcat:Distribution', 'description': 'S_USA.ProclaimedForest_Grassland.xml', 'mediaType': 'text/xml', 'title': 'Metadata'}, {'downloadURL': 'http://data.fs.usda.gov/geodata/edw/edw_resources/shp/S_USA.ProclaimedForest_Grassland.zip', '@type': 'dcat:Distribution', 'description': 'S_USA.ProclaimedForest_Grassland.zip', 'mediaType': 'application/zip', 'title': 'Shapefile'}, {'downloadURL': 'http://data.fs.usda.gov/geodata/edw/edw_resources/fc/S_USA.ProclaimedForest_Grassland.gdb.zip', '@type': 'dcat:Distribution', 'description': 'S_USA.ProclaimedForest_Grassland.gdb.zip', 'mediaType': 'application/zip', 'title': 'ESRI geodatabase XML'}, {'downloadURL': 'http://apps.fs.usda.gov/arcx/rest/services/EDW/EDW_ProclaimedForestsAndGrasslands_01/MapServer/generateKml', '@type': 'dcat:Distribution', 'description': 'Link to generate KML', 'mediaType': 'text/html', 'title': 'KML'}]",USDA-FS-00034
,,,,http://apps.fs.fed.us/arcx/rest/services/EDW/EDW_OtherSubSurfaceRight_01/MapServer,U.S. Forest Service Other Sub Surface Right,['geospatial'],,['005:000'],,"A map service on the www depicting areas with ownership parcels of the subsurface estate, excluding mineral rights; it is collected only if the subsurface estate is different than the overlying surface estate. The purpose of the data is to provide display, identification, and analysis tools for determining current boundary information for Forest Service managers, GIS Specialists, and others.",,,['005:96'],"{'hasEmail': 'mailto:data@fs.fed.us', '@type': 'vcard:Contact', 'fn': 'Dave Green'}",public,"{'@type': 'org:Organization', 'name': 'US Forest Service, Department of Agriculture'}","['ALP Land Dataset', 'Land Status', 'NFS Lands', 'Other Subsurface Right', 'USDA Forest Service']",https://creativecommons.org/publicdomain/zero/1.0/,Public,2015-06-02,R/PT1S,True,"[{'description': 'A map service on the www depicting areas with ownership parcels of the subsurface estate, excluding mineral rights; it is collected only if the subsurface estate is different than the overlying surface estate. The purpose of the data is to provide display, identification, and analysis tools for determining current boundary information for Forest Service managers, GIS Specialists, and others.', 'format': 'ArcGIS Map Service', 'title': 'US Forest Service Other Subsurface Right', 'mediaType': 'text/html', 'downloadURL': 'http://apps.fs.usda.gov/arcx/rest/services/EDW/EDW_OtherSubSurfaceRight_01/MapServer', '@type': 'dcat:Distribution'}, {'downloadURL': 'http://apps.fs.usda.gov/arcx/rest/services/EDW_FEATURE/EDW_OtherSubSurfaceRight_01/FeatureServer', '@type': 'dcat:Distribution', 'description': 'ArcGIS Feature Service', 'mediaType': 'text/html', 'title': 'US Forest Service Other Sub Surface Right'}, {'accessURL': 'http://apps.fs.usda.gov/arcx/rest/services/EDW/EDW_OtherSubSurfaceRight_01/MapServer', '@type': 'dcat:Distribution', 'format': 'API', 'description': 'Link to API', 'title': 'API'}, {'downloadURL': 'http://apps.fs.usda.gov/arcx/rest/services/EDW/EDW_OtherSubSurfaceRight_01/MapServer/generateKml', '@type': 'dcat:Distribution', 'description': 'Link to generate KML', 'mediaType': 'text/html', 'title': 'KML'}, {'downloadURL': 'http://data.fs.usda.gov/geodata/edw/edw_resources/meta/S_USA.OtherSubSurfaceRight.xml', '@type': 'dcat:Distribution', 'description': 'S_USA.OtherSubSurfaceRight.xml', 'mediaType': 'text/xml', 'title': 'Metadata'}, {'downloadURL': 'http://data.fs.usda.gov/geodata/edw/edw_resources/fc/S_USA.OtherSubSurfaceRight.gdb.zip', '@type': 'dcat:Distribution', 'description': 'S_USA.OtherSubSurfaceRight.gdb.zip', 'mediaType': 'application/zip', 'title': 'ESRI geodatabase XML'}, {'downloadURL': 'http://data.fs.usda.gov/geodata/edw/edw_resources/shp/S_USA.OtherSubSurfaceRight.zip', '@type': 'dcat:Distribution', 'description': 'S_USA.OtherSubSurfaceRight.zip', 'mediaType': 'application/zip', 'title': 'Shapefile'}]",USDA-FS-00070-2015
,,,,http://apps.fs.fed.us/arcx/rest/services/EDW/EDW_OtherSurfaceRight_01/MapServer,U.S. Forest Service Other Surface Right,['geospatial'],,['005:000'],,"A map service on the www depicting areas with a right to a surface resource, excluding rights of way. The purpose of the data is to provide display, identification, and analysis tools for determining current boundary information for Forest Service managers, GIS Specialists, and others.",,,['005:96'],"{'hasEmail': 'mailto:data@fs.fed.us', '@type': 'vcard:Contact', 'fn': 'Dave Green'}",public,"{'@type': 'org:Organization', 'name': 'US Forest Service, Department of Agriculture'}","['alp land dataset', 'land status', 'nfs lands', 'other surface right', 'usda forest service']",https://creativecommons.org/publicdomain/zero/1.0/,Public,2015-06-02,R/PT1S,True,"[{'description': 'A map service on the www depicting areas with a right to a surface resource, excluding rights of way. The purpose of the data is to provide display, identification, and analysis tools for determining current boundary information for Forest Service managers, GIS Specialists, and others.', 'format': 'ArcGIS Map Service', 'title': 'US Forest Service Other Surface Right', 'mediaType': 'text/html', 'downloadURL': 'http://apps.fs.usda.gov/arcx/rest/services/EDW/EDW_OtherSurfaceRight_01/MapServer', '@type': 'dcat:Distribution'}, {'downloadURL': 'http://apps.fs.usda.gov/arcx/rest/services/EDW_FEATURE/EDW_OtherSurfaceRight_01/FeatureServer', '@type': 'dcat:Distribution', 'description': 'ArcGIS Feature Service', 'mediaType': 'text/html', 'title': 'US Forest Service Other Surface Right'}, {'accessURL': 'http://apps.fs.usda.gov/arcx/rest/services/EDW/EDW_OtherSurfaceRight_01/MapServer', '@type': 'dcat:Distribution', 'format': 'API', 'description': 'Link to API', 'title': 'API'}, {'downloadURL': 'http://apps.fs.usda.gov/arcx/rest/services/EDW/EDW_OtherSurfaceRight_01/MapServer/generateKml', '@type': 'dcat:Distribution', 'description': 'Link to generate KML', 'mediaType': 'text/html', 'title': 'KML'}, {'downloadURL': 'http://data.fs.usda.gov/geodata/edw/edw_resources/meta/S_USA.OtherSurfaceRight.xml', '@type': 'dcat:Distribution', 'description': 'S_USA.OtherSurfaceRight.xml', 'mediaType': 'text/xml', 'title': 'Metadata'}, {'downloadURL': 'http://data.fs.usda.gov/geodata/edw/edw_resources/fc/S_USA.OtherSurfaceRight.gdb.zip', '@type': 'dcat:Distribution', 'description': 'S_USA.OtherSurfaceRight.gdb.zip', 'mediaType': 'application/zip', 'title': 'ESRI geodatabase XML'}, {'downloadURL': 'http://data.fs.usda.gov/geodata/edw/edw_resources/shp/S_USA.OtherSurfaceRight.zip', '@type': 'dcat:Distribution', 'description': 'S_USA.OtherSurfaceRight.zip', 'mediaType': 'application/zip', 'title': 'Shapefile'}]",USDA-FS-00071-2015
,,,,http://apps.fs.fed.us/ArcX/rest/services/EDW/EDW_Withdrawal_01/MapServer,"U.S. Forest Service Parcels withdrawn from settlement, sale, mineral location, and/or entry",['geospatial'],,['005:000'],,"A map service on the www depicting federal land parcels that are withdrawn from settlement, sale, location, or entry under some or all of the general land and mineral laws in order to maintain other public values or purposes. A withdrawal area has one or more associated segregations. A segregation is a specific activity from which the area has been withdrawn such as settlement, sale, location, or entry. The purpose of the data is to provide display, identification, and analysis tools for determining current boundary information for Forest Service managers, GIS Specialists, and others.",,,['005:96'],"{'hasEmail': 'mailto:data@fs.fed.us', '@type': 'vcard:Contact', 'fn': 'Dave Green'}",public,"{'@type': 'org:Organization', 'name': 'US Forest Service, Department of Agriculture'}","['federal land parcels', 'land', 'land status', 'segregations', 'usfs', 'withdrawal']",https://creativecommons.org/publicdomain/zero/1.0/,,2014-08-01,R/PT1S,,"[{'description': 'A map service on the www depicting federal land parcels that are withdrawn from settlement, sale, location, or entry under some or all of the general land and mineral laws in order to maintain other public values or purposes. A withdrawal area has one or more associated segregations. A segregation is a specific activity from which the area has been withdrawn such as settlement, sale, location, or entry. The purpose of the data is to provide display, identification, and analysis tools for determining current boundary information for Forest Service managers, GIS Specialists, and others.', 'format': 'ArcGIS Map Service', 'title': 'U.S. Forest Service Withdrawal', 'mediaType': 'text/html', 'downloadURL': 'http://apps.fs.usda.gov/ArcX/rest/services/EDW/EDW_Withdrawal_01/MapServer', '@type': 'dcat:Distribution'}, {'description': 'ArcGIS Feature Service', 'format': 'ArcGIS Feature Service', 'title': 'U.S. Forest Service Withdrawal', 'mediaType': 'text/html', 'downloadURL': 'http://apps.fs.usda.gov/arcx/rest/services/EDW_FEATURE/EDW_Withdrawal_01/FeatureServer', '@type': 'dcat:Distribution'}, {'accessURL': 'http://apps.fs.usda.gov/ArcX/rest/services/EDW/EDW_Withdrawal_01/MapServer', '@type': 'dcat:Distribution', 'format': 'API', 'description': 'Link to API', 'title': 'API'}, {'downloadURL': 'http://data.fs.usda.gov/geodata/edw/edw_resources/meta/S_USA.Withdrawal.xml', '@type': 'dcat:Distribution', 'description': 'S_USA.Withdrawal.xml', 'mediaType': 'text/xml', 'title': 'Metadata'}, {'downloadURL': 'http://data.fs.usda.gov/geodata/edw/edw_resources/shp/S_USA.Withdrawal.zip', '@type': 'dcat:Distribution', 'description': 'S_USA.Withdrawal.zip', 'mediaType': 'application/zip', 'title': 'Shapefile'}, {'downloadURL': 'http://data.fs.usda.gov/geodata/edw/edw_resources/fc/S_USA.Withdrawal.gdb.zip', '@type': 'dcat:Distribution', 'description': 'S_USA.Withdrawal.gdb.zip', 'mediaType': 'application/zip', 'title': 'ESRI geodatabase XML'}, {'downloadURL': 'http://apps.fs.usda.gov/arcx/rest/services/EDW/EDW_Withdrawal_01/MapServer/generateKml', '@type': 'dcat:Distribution', 'description': 'Link to generate KML', 'mediaType': 'text/html', 'title': 'KML'}]",USDA-FS-0051
,,,,http://apps.fs.fed.us/ArcX/rest/services/EDW/EDW_PeriodicalCicadaBroods_01/MapServer,U.S. Forest Service Periodical Cicada Broods,['geospatial'],,['005:000'],,"A map service on the www depicting periodical cicada distribution and expected year of emergence by cicada brood and county. The periodical cicada emerges in massive groups once every 13 or 17 years and is completely unique to North America. There are 15 of these mass groups, called broods, of periodical cicadas in the United States. This county-based data, complied by the USFS Northern Research Station, depict where and when the different broods of periodical cicadas are likely to emerge in the US through 2031. The data was compiled for the 2011 publication entitled ""Avian predators are less abundant during periodical cicada emergences, but why?"" (Koenig et al. http://dx.doi.org/10.1890/10-1583.1) using data from periodical cicada publications listed below. 1) Marlatt, C. L. 1907. ""The periodical cicada"". Bulletin of the USDA Bureau of Entomology 71:1–181. 2) Simon, C. 1988. ""Evolution of 13- and 17-year periodical cicadas"". (Homoptera: Cicadidae). Bulletin of the Entomological Society of America 34:163–176. 3) Liebhold, A. M., Bohne, M. J., and R. L. Lilja. 2013. ""Active Periodical Cicada Broods of the United States"". USDA Forest Service Northern Research Station, Northeastern Area State and Private Forestry.",,,['005:96'],"{'hasEmail': 'mailto:data@fs.fed.us', '@type': 'vcard:Contact', 'fn': 'Dave Green'}",public,"{'@type': 'org:Organization', 'name': 'US Forest Service, Department of Agriculture'}","['Cicada', 'broods', 'counties', 'distribution', 'emergence', 'forest service', 'periodical', 'usfs']",https://creativecommons.org/licenses/by/4.0,,2014-12-23,,,"[{'description': 'A map service on the www depicting periodical cicada distribution and expected year of emergence by cicada brood and county. The periodical cicada emerges in massive groups once every 13 or 17 years and is completely unique to North America. There are 15 of these mass groups, called broods, of periodical cicadas in the United States. This county-based data, complied by the USFS Northern Research Station, depict where and when the different broods of periodical cicadas are likely to emerge in the US through 2031. The data was compiled for the 2011 publication entitled ""Avian predators are less abundant during periodical cicada emergences, but why?"" (Koenig et al. http://dx.doi.org/10.1890/10-1583.1) using data from periodical cicada publications listed below. 1) Marlatt, C. L. 1907. ""The periodical cicada"". Bulletin of the USDA Bureau of Entomology 71:1\xe2\x80\x93181. 2) Simon, C. 1988. ""Evolution of 13- and 17-year periodical cicadas"". (Homoptera: Cicadidae). Bulletin of the Entomological Society of America 34:163\xe2\x80\x93176. 3) Liebhold, A. M., Bohne, M. J., and R. L. Lilja. 2013. ""Active Periodical Cicada Broods of the United States"". USDA Forest Service Northern Research Station, Northeastern Area State and Private Forestry.', 'format': 'ArcGIS Map Service', 'title': 'U.S. Forest Service Periodical Cicada Broods', 'mediaType': 'text/html', 'downloadURL': 'http://apps.fs.usda.gov/ArcX/rest/services/EDW/EDW_PeriodicalCicadaBroods_01/MapServer', '@type': 'dcat:Distribution'}, {'accessURL': 'http://apps.fs.usda.gov/ArcX/rest/services/EDW/EDW_PeriodicalCicadaBroods_01/MapServer', '@type': 'dcat:Distribution', 'format': 'API', 'description': 'Link to API', 'title': 'API'}, {'downloadURL': 'http://apps.fs.usda.gov/arcx/rest/services/EDW/EDW_PeriodicalCicadaBroods_01/MapServer/generateKml', '@type': 'dcat:Distribution', 'description': 'Link to generate KML', 'mediaType': 'text/html', 'title': 'KML'}]",USDA-FS-00023
,,,,http://apps.fs.fed.us/ArcX/rest/services/EDW/EDW_Section_01/MapServer,U.S. Forest Service Public Land Survey System Sections,['geospatial'],,['005:000'],,"A map service on the www depicting areas defined by the Public Lands Survey System Grid. Normally, 36 sections make up a township. Sections cover US Forest Service Unit Boundaries.",,,['005:96'],"{'hasEmail': 'mailto:data@fs.fed.us', '@type': 'vcard:Contact', 'fn': 'Dave Green'}",public,"{'@type': 'org:Organization', 'name': 'US Forest Service, Department of Agriculture'}","['land status', 'meridian code', 'nfs lands', 'range', 'section number', 'sections', 'township', 'usfs']",https://creativecommons.org/publicdomain/zero/1.0/,,2014-08-01,,True,"[{'description': 'A map service on the www depicting areas defined by the Public Lands Survey System Grid. Normally, 36 sections make up a township. Sections cover US Forest Service Unit Boundaries.', 'format': 'ArcGIS Map Service', 'title': 'U.S. Forest Service Public Land Survey System Sections', 'mediaType': 'text/html', 'downloadURL': 'http://apps.fs.usda.gov/arcx/rest/services/EDW/EDW_Section_01/MapServer', '@type': 'dcat:Distribution'}, {'description': 'ArcGIS Feature Service', 'format': 'ArcGIS Feature Service', 'title': 'U.S. Forest Service Public Land Survey System Sections', 'mediaType': 'text/html', 'downloadURL': 'http://apps.fs.usda.gov/arcx/rest/services/EDW_FEATURE/EDW_Section_01/FeatureServer', '@type': 'dcat:Distribution'}, {'accessURL': 'http://apps.fs.usda.gov/ArcX/rest/services/EDW/EDW_Section_01/MapServer', '@type': 'dcat:Distribution', 'format': 'API', 'description': 'Link to API', 'title': 'API'}, {'downloadURL': 'http://data.fs.usda.gov/geodata/edw/edw_resources/meta/S_USA.Section.xml', '@type': 'dcat:Distribution', 'description': 'S_USA.Section.xml', 'mediaType': 'text/xml', 'title': 'Metadata'}, {'downloadURL': 'http://data.fs.usda.gov/geodata/edw/edw_resources/shp/S_USA.Section.zip', '@type': 'dcat:Distribution', 'description': 'S_USA.Section.zip', 'mediaType': 'application/zip', 'title': 'Shapefile'}, {'downloadURL': 'http://data.fs.usda.gov/geodata/edw/edw_resources/fc/S_USA.Section.gdb.zip', '@type': 'dcat:Distribution', 'description': 'S_USA.Section.gdb.zip', 'mediaType': 'application/zip', 'title': 'ESRI geodatabase XML'}, {'downloadURL': 'http://apps.fs.usda.gov/arcx/rest/services/EDW/EDW_Section_01/MapServer/generateKml', '@type': 'dcat:Distribution', 'description': 'Link to generate KML', 'mediaType': 'text/html', 'title': 'KML'}]",USDA-FS-00039
,,,,http://apps.fs.fed.us/ArcX/rest/services/EDW/EDW_Township_01/MapServer,U.S. Forest Service Public Land Survey System Townships,['geospatial'],,['005:000'],,"A map service on the www depicting areas defined by the Public Lands Survey System grid that are referenced by their tier and range numbers, and are normally rectangles approximately six miles on a side with boundaries conforming to meridians and parallels. This map service provides display, identification, and analysis tools for determining current boundary information for Forest Service managers, GIS Specialists, and others.",,,['005:96'],"{'hasEmail': 'mailto:data@fs.fed.us', '@type': 'vcard:Contact', 'fn': 'Dave Green'}",public,"{'@type': 'org:Organization', 'name': 'US Forest Service, Department of Agriculture'}","['land status', 'plss', 'public lands survey system', 'township', 'usfs']",https://creativecommons.org/publicdomain/zero/1.0/,,2014-08-01,R/PT1S,,"[{'description': 'A map service on the www depicting areas defined by the Public Lands Survey System grid that are referenced by their tier and range numbers, and are normally rectangles approximately six miles on a side with boundaries conforming to meridians and parallels. This map service provides display, identification, and analysis tools for determining current boundary information for Forest Service managers, GIS Specialists, and others.', 'format': 'ArcGIS Map Service', 'title': 'U.S. Forest Service Public Land Survey System Townships', 'mediaType': 'text/html', 'downloadURL': 'http://apps.fs.usda.gov/ArcX/rest/services/EDW/EDW_Township_01/MapServer', '@type': 'dcat:Distribution'}, {'description': 'ArcGIS Feature Service', 'format': 'ArcGIS Feature Service', 'title': 'U.S. Forest Service Public Land Survey System Townships', 'mediaType': 'text/html', 'downloadURL': 'http://apps.fs.usda.gov/arcx/rest/services/EDW_FEATURE/EDW_Township_01/FeatureServer', '@type': 'dcat:Distribution'}, {'accessURL': 'http://apps.fs.usda.gov/ArcX/rest/services/EDW/EDW_Township_01/MapServer', '@type': 'dcat:Distribution', 'format': 'API', 'description': 'Link to API', 'title': 'API'}, {'downloadURL': 'http://data.fs.usda.gov/geodata/edw/edw_resources/meta/S_USA.Township.xml', '@type': 'dcat:Distribution', 'description': 'S_USA.Township.xml', 'mediaType': 'text/xml', 'title': 'Metadata'}, {'downloadURL': 'http://data.fs.usda.gov/geodata/edw/edw_resources/shp/S_USA.Township.zip', '@type': 'dcat:Distribution', 'description': 'S_USA.Township.zip', 'mediaType': 'application/zip', 'title': 'Shapefile'}, {'downloadURL': 'http://data.fs.usda.gov/geodata/edw/edw_resources/fc/S_USA.Township.gdb.zip', '@type': 'dcat:Distribution', 'description': 'S_USA.Township.gdb.zip', 'mediaType': 'application/zip', 'title': 'ESRI geodatabase XML'}, {'downloadURL': 'http://apps.fs.usda.gov/arcx/rest/services/EDW/EDW_Township_01/MapServer/generateKml', '@type': 'dcat:Distribution', 'description': 'Link to generate KML', 'mediaType': 'application/vnd.google-earth.kml+xml', 'title': 'KML'}]",USDA-FS-00044
,,,,http://apps.fs.usda.gov/arcx/rest/services/RDW_AdminAndOwnership/PublicPrivateForestOwnership_CONUS/MapServer,U.S. Forest Service Public and Private Forest Ownership Contiguous United States,['geospatial'],,['005:000'],,"The data are designed for strategic analyses at a national or regional scale which require spatially explicit information regarding the extent, distribution, and prevalence of the ownership types represented. The data are not recommended for tactical analyses on a sub-regional scale, or for informing local management decisions. Furthermore, map accuracies vary considerably and thus the utility of these data can vary geographically under different ownership patterns.",,,['005:96'],"{'hasEmail': 'mailto:jhhewes@fs.fed.us', '@type': 'vcard:Contact', 'fn': 'Jake Hewes'}",public,"{'@type': 'org:Organization', 'name': 'US Forest Service, Department of Agriculture'}",['forest ownership'],https://creativecommons.org/publicdomain/zero/1.0/,,2015-08-31,,,"[{'description': 'The data are designed for strategic analyses at a national or regional scale which require spatially explicit information regarding the extent, distribution, and prevalence of the ownership types represented. The data are not recommended for tactical analyses on a sub-regional scale, or for informing local management decisions. Furthermore, map accuracies vary considerably and thus the utility of these data can vary geographically under different ownership patterns.', 'format': 'ArcGIS Map Service', 'title': 'U.S. Forest Service Public and Private Forest Ownership Contiguous United States', 'mediaType': 'text/html', 'downloadURL': 'http://apps.fs.usda.gov/arcx/rest/services/RDW_AdminAndOwnership/PublicPrivateForestOwnership_CONUS/MapServer', '@type': 'dcat:Distribution'}, {'downloadURL': 'http://dx.doi.org/10.2737/RDS-2014-0002', '@type': 'dcat:Distribution', 'description': 'Link to Metadata and Data Download', 'mediaType': 'text/html', 'title': 'Metadata and Data Download Page'}, {'accessURL': 'http://apps.fs.usda.gov/arcx/rest/services/RDW_AdminAndOwnership/PublicPrivateForestOwnership_CONUS/MapServer', '@type': 'dcat:Distribution', 'format': 'API', 'description': 'Link to API', 'title': 'API'}, {'downloadURL': 'http://apps.fs.usda.gov/arcx/rest/services/RDW_AdminAndOwnership/PublicPrivateForestOwnership_CONUS/MapServer/generateKml', '@type': 'dcat:Distribution', 'description': 'Link to generate KML', 'mediaType': 'text/html', 'title': 'KML'}]",USDA-FS-00081-2015
