issued,describedByType,systemOfRecords,references,landingPage,title,theme,spatial,programCode,describedBy,description,language,isPartOf,bureauCode,contactPoint,accessLevel,publisher,keyword,license,rights,modified,accrualPeriodicity,dataQuality,distribution,identifier
2014-08-27,text/html,http://www.ams.usda.gov/AMSv1.0/getfile?dDocName=STELPRDC5108128.,['http://www.ams.usda.gov/AMSv1.0/getfile?dDocName=STELPRDC5108128'],,AMS FOIA REQUESTS RECEIVED,['FOIA'],Global,['005:047'],,"AMS began posting a report on its website of all of the incoming Freedom of Information Act requests received by the Agency.  The report includes the name of the requestor, the date the request was received, and a brief description of the information requested.",,,['005:45'],"{'hasEmail': 'mailto:AMS.FOIA@usda.gov', '@type': 'vcard:Contact', 'fn': 'Carrie Helmold'}",public,"{'@type': 'org:Organization', 'name': 'Department of Agriculture'}","['AMS Freedom Of Information Act', 'FOIA', 'Request Received']",https://creativecommons.org/publicdomain/zero/1.0/,Public,2014-07-31,R/P1M,True,"[{'downloadURL': 'http://www.ams.usda.gov/AMSv1.0/getfile?dDocName=STELPRDC5108128', '@type': 'dcat:Distribution', 'description': 'This report includes the name of the requestor, the date the request was received, and a brief description of the information requested.', 'mediaType': 'text/html', 'title': 'AMS FOIA REQUESTS RECEIVED'}]",USDA-0000
2012-03-28,,,['http://www.ams.usda.gov/AMSv1.0/LPS'],,AMS Market News Historical Annual  Summaries,,United States,['005:047'],http://www.ams.usda.gov/AMSv1.0/LPS,"The primary function of the AMS Market News Program is to compile and disseminate information that will aid producers, consumers, and distributors in the sale and purchase of agricultural related products nationally and internationally.",,,['005:45'],"{'hasEmail': 'mailto:WASH.LPGMN@AMS.USDA.GOV', '@type': 'vcard:Contact', 'fn': 'Rick Tanger'}",public,"{'@type': 'org:Organization', 'name': 'Agricultural Marketing Service, Department of Agriculture'}","['Beans', 'Beef', 'By-products', 'Calves', 'Cattle', 'Chicken', 'Duck', 'Eggs', 'Feeder Pigs', 'Feedstuff', 'Fowl', 'Goats', 'Grain', 'Grain Basis', 'Hay', 'Hogs', 'Lamb', 'Lentils', 'Offal', 'Peas', 'Pork', 'Rabbits', 'Retail', 'Sheep', 'Turkey']",https://creativecommons.org/publicdomain/zero/1.0/,,2014-02-26,R/P1Y,,"[{'downloadURL': 'http://www.ams.usda.gov/AMSv1.0/MarketNewsandDataDotGov', 'mediaType': 'application/xls', '@type': 'dcat:Distribution', 'title': 'Excel Document'}]",USDA-35782
2011-09-22,,,['http://www.ams.usda.gov/gtr'],,Barge Grain Movements,,US,['005:047'],,Table 10: Barge Grain Movements,,,['005:45'],"{'hasEmail': 'mailto:pierre.bahizi@ams.usda.gov', '@type': 'vcard:Contact', 'fn': 'Pierre Bahizi'}",public,"{'@type': 'org:Organization', 'name': 'Agricultural Marketing Service, Department of Agriculture'}","['barge', 'carload', 'domestic', 'export', 'fuel surcharge', 'grain', 'grain inspections', 'international', 'ocean freight', 'ocean vessel', 'port region', 'railcar auction', 'railroad', 'shipment', 'shuttle train', 'truck', 'unit train']",https://creativecommons.org/licenses/by/4.0,,2014-12-23,R/P1W,,"[{'downloadURL': 'http://www.ams.usda.gov/sites/default/files/media/New%20Table10%20BargeMvmts.xlsx', 'mediaType': 'application/xls', '@type': 'dcat:Distribution', 'title': 'Excel Document'}]",USDA-5239
,,,,,"Brazilian Soybean Export Truck Transportation Weighted Average Prices, 2013/15",,,['005:047'],,Last three years monthly average costs of shipping a metric ton (mt) of Braziian soybeans per 100 miles by truck. This is figure 5 of the Brazil Soybean Transportation report.,,,['005:45'],"{'hasEmail': 'mailto:delmy.salin@ams.usda.gov', '@type': 'vcard:Contact', 'fn': 'Delmy L. Salin'}",public,"{'@type': 'org:Organization', 'name': 'Agricultural Marketing Service'}","['Brazil', 'exports truck index', 'soybeans', 'transportation cost', 'truck rates']",https://creativecommons.org/publicdomain/zero/1.0/,,2015-09-21,,,"[{'downloadURL': 'http://www.ams.usda.gov/sites/default/files/media/Brazil_Qtr2_Figure_5.xlsx', '@type': 'dcat:Distribution', 'format': 'application/excel', 'mediaType': 'application/vnd.openxmlformats-officedocument.spreadsheetml.sheet', 'title': 'Brazilian Soybean Export Truck Transportation Weighted Average Prices, 2013/15'}]",usda-ams-2015-N028
,,,,,"Clone of Quarterly Costs Of Transporting Brazilian Soybeans From The Southern Ports To Hamburg, Germany",,,['005:047'],,"Quarterly total landed costs (truck and ocean) of shipping Brazilian soybeans through the ports of Santos, Paranaguá, and Rio Grande to Hamburg, Germany. This is table 4 of the Brazil Soybean Transportation report.",,,['005:45'],"{'hasEmail': 'mailto:delmy.salin@ams.usda.gov', '@type': 'vcard:Contact', 'fn': 'Delmy L. Salin'}",public,"{'@type': 'org:Organization', 'name': 'Agricultural Marketing Service'}","['Brazil', 'Germany', 'Goi\xc3\xa1s', 'Hamburg', 'Mato Grosso', 'Paranagu\xc3\xa1', 'Paran\xc3\xa1', 'Rio Grande do Sul', 'Santos', 'farm price', 'ocean rates', 'ports', 'soybeans', 'transportation cost', 'truck rates']",https://creativecommons.org/publicdomain/zero/1.0/,,2015-09-21,,,[],usda-ams-2015-N032
2013-04-26,,,['http://marketnews.usda.gov/'],http://marketnews.usda.gov/,Cotton Market News Search,,United States,['005:047'],,"The primary function of the Cotton Market News Division of the Cotton and Tobacco Program is to compile and disseminate information that will aid producers, consumers, and distributors in the sale and purchase of cotton  nationally and internationally.",,,['005:45'],"{'hasEmail': 'mailto:barbara.meredith@ams.usda.gov', '@type': 'vcard:Contact', 'fn': 'Barbara Meredith'}",public,"{'@type': 'org:Organization', 'name': 'Agricultural Marketing Service, Department of Agriculture'}","['Cotton', 'Cotton Quality', 'carryover', 'extra long staple', 'linters', 'price', 'quality', 'upland', 'varieties planted', 'weekly market review']",https://creativecommons.org/licenses/by/4.0,,2014-12-23,R/P1D,,"[{'downloadURL': 'http://marketnews.usda.gov/', 'mediaType': 'text/html', '@type': 'dcat:Distribution', 'title': 'Web Page'}]",USDA-26491
2013-04-26,,,['http://marketnews.usda.gov/'],,Dairy Market News Search,,United States,['005:047'],,"The primary function of the Dairy Market News Division of the Dairy Program  is to compile and disseminate information that will aid producers, consumers, and distributors in the sale and purchase of dairy products nationally and internationally.",,,['005:45'],"{'hasEmail': 'mailto:DonaldO.Nelson@ams.usda.gov', '@type': 'vcard:Contact', 'fn': 'Don Nelson'}",public,"{'@type': 'org:Organization', 'name': 'Agricultural Marketing Service, Department of Agriculture'}","['Butter', 'Cheese', 'Cream', 'Dairy', 'Milk', 'Product Prices', 'butter', 'cheese', 'dry and fluid products', 'lactose', 'nonfat dry milk', 'whey']",https://creativecommons.org/licenses/by/4.0,,2014-12-23,R/P1D,,"[{'downloadURL': 'http://marketnews.usda.gov/', 'mediaType': 'text/html', '@type': 'dcat:Distribution', 'title': 'Web Page'}]",USDA-26481
2012-04-13,,,['http://www.ams.usda.gov/AMSv1.0/ams.fetchTemplateData.do?template=TemplateL&navID=FindaMarketNewsreportDairyLandingPage&rightNav1=FindaMarketNewsreportDairyLandingPage&topNav=&leftNav=CommodityAreas&page=DairyMarketNews&description=Dairy+Market+News'],,Dairy Market News Search,,"United States, Europe, Ocenia",['005:047'],http://www.ams.usda.gov/AMSv1.0/ams.fetchTemplateData.do?template=TemplateL&navID=FindaMarketNewsreportDairyLandingPage&rightNav1=FindaMarketNewsreportDairyLandingPage&topNav=&leftNav=CommodityAreas&page=DairyMarketNews&description=Dairy+Market+News,"Dairy Market News covers the supply, demand, and price situation every week on a regional, national, and international basis for milk, butter, cheese, and dry and fluid products.",,,['005:45'],"{'hasEmail': 'mailto:DonaldO.Nelson@ams.usda.gov', '@type': 'vcard:Contact', 'fn': 'Don Nelson'}",public,"{'@type': 'org:Organization', 'name': 'Agricultural Marketing Service, Department of Agriculture'}","['Butter', 'Butter Grade AA', 'CME', 'Cheese', 'Cheese Barrels', 'Dairy', 'Dry Milk Products', 'Dry Whey Products', 'Extra Grade', 'Fluid Milk and Cream', 'International', 'Market News', 'Milk', 'Nonfat Dry Milk Grade A']",https://creativecommons.org/publicdomain/zero/1.0/,,2014-02-21,R/P1W,,"[{'downloadURL': 'http://marketnews.usda.gov/portal/da?&paf_gear_id=5300015&paf_dm=full&reportConfig=true&category=Cheese', 'mediaType': 'text/html', '@type': 'dcat:Distribution', 'title': 'Web Page'}]",USDA-6234
2010-10-01,,,['https://apps.ams.usda.gov/FarmersMarketsExport/ExcelExport.aspx'],,Farmers Markets Directory and Geographic Data,,United States,['005:047'],,"Longitude and latitude, state, address, name, and zip code of Farmers Markets in the United States",,,['005:45'],"{'hasEmail': 'mailto:DirectoryUpdates@ams.usda.gov', '@type': 'vcard:Contact', 'fn': 'Edward Ragland'}",public,"{'@type': 'org:Organization', 'name': 'Agricultural Marketing Service, Department of Agriculture'}","['Baked Goods', 'Butter', 'Cheese', 'Crafts', 'Dairy', 'Direct to Consumer', 'Farmers Markets', 'Flowers', 'Fresh Fruit', 'Herbs', 'Honey', 'Local Food', 'Maple', 'Meat', 'Nuts', 'Organic', 'Plants', 'Prepared Food', 'Preserves', 'Processed Food', 'Seafood', 'Vegetables', 'Yogurt']",https://creativecommons.org/licenses/by/4.0,,2014-12-23,R/P0.33W,,"[{'downloadURL': 'http://www.ams.usda.gov/AMSv1.0/getfile?dDocName=STELPRDC5087258', 'mediaType': 'application/xls', '@type': 'dcat:Distribution', 'title': 'Web Page'}]",USDA-4383
2013-01-05,,,['http://www.ams.usda.gov/AMSv1.0/getfile?dDocName=STELPRDC5091437'],,Food Hubs,,United States,['005:047'],http://www.ams.usda.gov/AMSv1.0/getfile?dDocName=STELPRDC5091437,"This is a list of food hubs that USDA's Agricultural Marketing Service had on record as of January 2013.  By offering a combination of production, aggregation, distribution, and marketing services, food hubs make it possible for producers to gain entry into new and additional markets that would be difficult or impossible to access on their own.",,,['005:45'],"{'hasEmail': 'mailto:James.Barham@ams.usda.gov', '@type': 'vcard:Contact', 'fn': 'James Barham'}",public,"{'@type': 'org:Organization', 'name': 'Agricultural Marketing Service, Department of Agriculture'}","['aggregation', 'distribution', 'food hub', 'food value chain']",https://creativecommons.org/publicdomain/zero/1.0/,,2014-02-26,R/P1M,,"[{'downloadURL': 'http://www.ams.usda.gov/AMSv1.0/ams.fetchTemplateData.do?template=TemplateA&navID=WholesaleandFarmersMarkets&leftNav=WholesaleandFarmersMarkets&page=FoodHubsandOtherMarketAccessStrategies&description=Food%20Hubs%20and%20other%20Aggregation%20Models', 'mediaType': 'text/html', '@type': 'dcat:Distribution', 'title': 'Web Page'}]",USDA-26271
2012-08-07,,,['http://www.marketnews.usda.gov/portal/fv'],,Fruit and Vegetable Market News Custom Search,,United States,['005:047'],http://www.marketnews.usda.gov/portal/fv,"The primary function of the Fruit and Vegetable  Market News Division of the Fruit and Vegetable Programs  is to provide an exchange of information for growers, shippers, wholesalers, researchers and others on supplies, demand and prices of fresh fruit and vegetables and speciality crops.",,,['005:45'],"{'hasEmail': 'mailto:Fred.Teensma@ams.usda.gov', '@type': 'vcard:Contact', 'fn': 'Fred Teensma'}",public,"{'@type': 'org:Organization', 'name': 'Agricultural Marketing Service, Department of Agriculture'}","['FOB', 'Rail', 'Retail', 'Truck', 'apple', 'apricot', 'artichoke', 'asparagus', 'avocado', 'banana', 'bean', 'beet', 'berries', 'blueberries', 'blueberry', 'broccoli', 'brusselssprouts', 'cabbage', 'cantaloupe', 'carrot', 'cauliflower', 'celery', 'cherries', 'cherry', 'citrus', 'corn', 'cranberries', 'cranberry', 'cucumber', 'eggplant', 'endive', 'escarole', 'fruit', 'garlic', 'grape', 'greenhouse', 'greens', 'herbs', 'honeydew', 'kiwifruit', 'lettuce', 'mango', 'melon', 'movement', 'mushroom', 'nectarine', 'non-citrus', 'nuts', 'okra', 'onions', 'organic', 'ornamental', 'papaya', 'parsley', 'parsnip', 'pea', 'peach', 'pear', 'pepper', 'persimmon', 'pineapple', 'plantain', 'plum', 'pomegranate', 'potatoes', 'produce', 'prune', 'pumpkin', 'radishesraspberries', 'raspberry', 'rhubarb', 'rutabaga', 'shipments', 'shipping point', 'spinach', 'squash', 'strawberries', 'strawberry', 'sweetpotato', 'terminal market', 'tomato', 'turnip', 'vegetable', 'watermelon', 'wholesale market']",https://creativecommons.org/licenses/by/4.0,,2014-12-23,R/P1D,,"[{'downloadURL': 'http://www.marketnews.usda.gov/portal/fv?&paf_gear_id=1200002&repType=wiz&paf_dm=full&startIndex=1&dr=1', 'mediaType': 'text/html', '@type': 'dcat:Distribution', 'title': 'Web Page'}]",USDA-9211
2013-04-26,,,['http://marketnews.usda.gov/'],,Fruit and Vegetable Market News Search,,United States,['005:047'],,"The primary function of the Fruit and Vegetable Market News Division of the Fruit and Vegetable Program is to compile and disseminate information that will aid producers, consumers, and distributors in the sale and purchase of poultry and their related products nationally and internationally.",,,['005:45'],"{'hasEmail': 'mailto:Fred.Teensma@ams.usda.gov', '@type': 'vcard:Contact', 'fn': 'Fred Teensma'}",public,"{'@type': 'org:Organization', 'name': 'Agricultural Marketing Service, Department of Agriculture'}","['FOB', 'Rail', 'Retail', 'Truck', 'apple', 'apricot', 'artichoke', 'asparagus', 'avocado', 'banana', 'bean', 'beet', 'berries', 'blueberries', 'blueberry', 'broccoli', 'brusselssprouts', 'cabbage', 'cantaloupe', 'carrot', 'cauliflower', 'celery', 'cherries', 'cherry', 'citrus', 'corn', 'cranberries', 'cranberry', 'cucumber', 'eggplant', 'endive', 'escarole', 'fruit', 'garlic', 'grape', 'greenhouse', 'greens', 'herbs', 'honey', 'honeydew', 'kiwifruit', 'lettuce', 'mango', 'melon', 'movement', 'mushroom', 'nectarine', 'non-citrus', 'nuts', 'okra', 'onions', 'organic', 'ornamental', 'papaya', 'parsley', 'parsnip', 'pea', 'peach', 'pear', 'pecans', 'pepper', 'persimmon', 'pineapple', 'plantain', 'plum', 'pomegranate', 'potatoes', 'produce', 'prune', 'pumpkin', 'radishesraspberries', 'raspberry', 'rhubarb', 'rutabaga', 'shipments', 'shipping point', 'spinach', 'squash', 'strawberries', 'strawberry', 'sweetpotato', 'terminal market', 'tomato', 'turnip', 'vegetable', 'watermelon', 'wholesale market']",https://creativecommons.org/licenses/by/4.0,,2014-12-23,R/P1D,,"[{'downloadURL': 'http://marketnews.usda.gov/', 'mediaType': 'text/html', '@type': 'dcat:Distribution', 'title': 'Web Page'}]",USDA-26521
2011-09-22,,,['http://www.ams.usda.gov/gtr'],,Grain Barge Movements through Mississippi River Locks 27,,US,['005:047'],,Figure 10: Grain Barge Movements through Mississippi River Locks 27,,,['005:45'],"{'hasEmail': 'mailto:pierre.bahizi@ams.usda.gov', '@type': 'vcard:Contact', 'fn': 'Pierre Bahizi'}",public,"{'@type': 'org:Organization', 'name': 'Agricultural Marketing Service, Department of Agriculture'}","['barge', 'carload', 'domestic', 'export', 'fuel surcharge', 'grain', 'grain inspections', 'international', 'ocean freight', 'ocean vessel', 'port region', 'railcar auction', 'railroad', 'shipment', 'shuttle train', 'truck', 'unit train']",https://creativecommons.org/licenses/by/4.0,,2014-12-23,R/P1W,,"[{'downloadURL': 'http://www.ams.usda.gov/sites/default/files/media/New%20Figure10_bargemvmtsLock27.xlsx', 'mediaType': 'application/xls', '@type': 'dcat:Distribution', 'title': 'Excel Document'}]",USDA-5240
2011-09-22,,,['http://www.ams.usda.gov/gtr'],,Grain Barges Unloaded in the New Orleans Port Region,,Global,['005:047'],,Figure 12: Grain Barges Unloaded in the New Orleans Port Region,,,['005:45'],"{'hasEmail': 'mailto:pierre.bahizi@ams.usda.gov', '@type': 'vcard:Contact', 'fn': 'Pierre Bahizi'}",public,"{'@type': 'org:Organization', 'name': 'Agricultural Marketing Service, Department of Agriculture'}","['barge', 'carload', 'domestic', 'export', 'fuel surcharge', 'grain', 'grain inspections', 'international', 'ocean freight', 'ocean vessel', 'port region', 'railcar auction', 'railroad', 'shipment', 'shuttle train', 'truck', 'unit train']",https://creativecommons.org/licenses/by/4.0,,2014-12-23,R/P1W,,"[{'downloadURL': 'http://www.ams.usda.gov/sites/default/files/media/New%20figure12_barges%20unloaded%20NOLA.xlsx', 'mediaType': 'application/xls', '@type': 'dcat:Distribution', 'title': 'Excel Document'}]",USDA-5242
2011-12-09,,,['http://www.ams.usda.gov/gtr'],,Grain Inspections for Export by Port Region,,Global,['005:047'],,Table 16: Grain Inspections for Export by Port Region,,,['005:45'],"{'hasEmail': 'mailto:pierre.bahizi@ams.usda.gov', '@type': 'vcard:Contact', 'fn': 'Pierre Bahizi'}",public,"{'@type': 'org:Organization', 'name': 'Agricultural Marketing Service, Department of Agriculture'}","['barge', 'carload', 'domestic', 'export', 'fuel surcharge', 'grain', 'grain inspections', 'international', 'ocean freight', 'ocean vessel', 'port region', 'railcar auction', 'railroad', 'shipment', 'shuttle train', 'truck', 'unit train']",https://creativecommons.org/licenses/by/4.0,,2014-12-23,R/P1W,,"[{'downloadURL': 'http://www.ams.usda.gov/sites/default/files/media/New%20Table16ExptInspsweb.xlsx', 'mediaType': 'application/xls', '@type': 'dcat:Distribution', 'title': 'Excel Document'}]",USDA-5247
2011-09-22,,,['http://www.ams.usda.gov/gtr'],,Grain Transport Cost Indicators,,US,['005:047'],,Table 1: Grain Transport Cost Indicators,,,['005:45'],"{'hasEmail': 'mailto:pierre.bahizi@ams.usda.gov', '@type': 'vcard:Contact', 'fn': 'Pierre Bahizi'}",public,"{'@type': 'org:Organization', 'name': 'Agricultural Marketing Service, Department of Agriculture'}","['barge', 'carload', 'domestic', 'export', 'fuel surcharge', 'grain', 'grain inspections', 'international', 'ocean freight', 'ocean vessel', 'port region', 'railcar auction', 'railroad', 'shipment', 'shuttle train', 'truck', 'unit train']",https://creativecommons.org/licenses/by/4.0,,2014-12-23,R/P1W,,"[{'downloadURL': 'http://www.ams.usda.gov/sites/default/files/media/GTRTable1.xlsx', 'mediaType': 'application/xls', '@type': 'dcat:Distribution', 'title': 'Excel Document'}]",USDA-5225
2011-09-22,,,['http://www.ams.usda.gov/gtr'],,Grain Transportation Report Rail Car Auction Offerings,,US,['005:047'],,Table 5: Rail Car Auction Offerings,,,['005:45'],"{'hasEmail': 'mailto:pierre.bahizi@ams.usda.gov', '@type': 'vcard:Contact', 'fn': 'Pierre Bahizi'}",public,"{'@type': 'org:Organization', 'name': 'Agricultural Marketing Service, Department of Agriculture'}","['barge', 'carload', 'domestic', 'export', 'fuel surcharge', 'grain', 'grain inspections', 'international', 'ocean freight', 'ocean vessel', 'port region', 'railcar auction', 'railroad', 'shipment', 'shuttle train', 'truck', 'unit train']",https://creativecommons.org/licenses/by/4.0,,2014-12-23,R/P1W,,"[{'downloadURL': 'https://www.ams.usda.gov/sites/default/files/media/Table5_RailCarAuctionOfferings.xlsm', 'mediaType': 'application/xls', '@type': 'dcat:Distribution', 'title': 'Excel Document'}]",USDA-5232
2011-09-22,,,['http://www.ams.usda.gov/gtr'],,Grain Transportation Report U.S. Origins to Export Position Price Spreads ($/bushel),,US,['005:047'],,Table 2: Market Update: U.S. Origins to Export Position Price Spreads ($/bushel),,,['005:45'],"{'hasEmail': 'mailto:pierre.bahizi@ams.usda.gov', '@type': 'vcard:Contact', 'fn': 'Pierre Bahizi'}",public,"{'@type': 'org:Organization', 'name': 'Agricultural Marketing Service, Department of Agriculture'}","['barge', 'carload', 'domestic', 'export', 'fuel surcharge', 'grain', 'grain inspections', 'international', 'ocean freight', 'ocean vessel', 'port region', 'railcar auction', 'railroad', 'shipment', 'shuttle train', 'truck', 'unit train']",https://creativecommons.org/licenses/by/4.0,,2014-12-23,R/P1W,,"[{'downloadURL': 'http://www.ams.usda.gov/sites/default/files/media/GTRTable2.xlsx', 'mediaType': 'application/xls', '@type': 'dcat:Distribution', 'title': 'Excel Document'}]",USDA-5230
2011-09-22,,,['http://www.ams.usda.gov/gtr'],,Grain Transportation Report: Bids/Offers for Railcars to be Delivered in the Secondary Market,,Global,['005:047'],,"Figure 4, 5, 6: Bids/Offers for Railcars to be Delivered in the Secondary Market",,,['005:45'],"{'hasEmail': 'mailto:pierre.bahizi@ams.usda.gov', '@type': 'vcard:Contact', 'fn': 'Pierre Bahizi'}",public,"{'@type': 'org:Organization', 'name': 'Agricultural Marketing Service, Department of Agriculture'}","['barge', 'carload', 'domestic', 'export', 'fuel surcharge', 'grain', 'grain inspections', 'international', 'ocean freight', 'ocean vessel', 'port region', 'railcar auction', 'railroad', 'shipment', 'shuttle train', 'truck', 'unit train']",https://creativecommons.org/licenses/by/4.0,,2014-12-23,R/P1W,,"[{'downloadURL': 'http://www.ams.usda.gov/sites/default/files/media/Figure4_BidsOffersRailcarstobeDeliveredMonth1SecondaryMarket.xlsx', 'mediaType': 'application/xls', '@type': 'dcat:Distribution', 'title': 'Excel Document'}]",USDA-5233
2011-09-22,,,['http://www.ams.usda.gov/gtr'],,Grain Transportation Report: Rail Deliveries to Port,,US,['005:047'],,Grain Transportation Report Table 3: Rail Deliveries to Port,,,['005:45'],"{'hasEmail': 'mailto:pierre.bahizi@ams.usda.gov', '@type': 'vcard:Contact', 'fn': 'Pierre Bahizi'}",public,"{'@type': 'org:Organization', 'name': 'Agricultural Marketing Service, Department of Agriculture'}","['barge', 'carload', 'domestic', 'export', 'fuel surcharge', 'grain', 'grain inspections', 'international', 'ocean freight', 'ocean vessel', 'port region', 'railcar auction', 'railroad', 'shipment', 'shuttle train', 'truck', 'unit train']",https://creativecommons.org/licenses/by/4.0,,2014-12-23,R/P1W,,"[{'downloadURL': 'http://www.ams.usda.gov/sites/default/files/media/GTRTable3.xlsx', 'mediaType': 'application/xls', '@type': 'dcat:Distribution', 'title': 'Excel Document'}]",USDA-5231
2011-09-22,,,['http://www.ams.usda.gov/gtr'],,"Grain Vessel Rates, U.S. to Japan",,Global,['005:047'],,"Figure 17: Grain Vessel Rates, U.S. to Japan",,,['005:45'],"{'hasEmail': 'mailto:pierre.bahizi@ams.usda.gov', '@type': 'vcard:Contact', 'fn': 'Pierre Bahizi'}",public,"{'@type': 'org:Organization', 'name': 'Agricultural Marketing Service, Department of Agriculture'}","['barge', 'carload', 'domestic', 'export', 'fuel surcharge', 'grain', 'grain inspections', 'international', 'ocean freight', 'ocean vessel', 'port region', 'railcar auction', 'railroad', 'shipment', 'shuttle train', 'truck', 'unit train']",https://creativecommons.org/licenses/by/4.0,,2014-12-23,R/P1M,,"[{'downloadURL': 'http://www.ams.usda.gov/sites/default/files/media/New%20Figure17_Rates%20Web.xlsx', 'mediaType': 'application/xls', '@type': 'dcat:Distribution', 'title': 'Excel Document'}]",USDA-5251
2011-09-22,,,['http://www.ams.usda.gov/gtr'],,Illinois River Barge Freight Rate,,Global,['005:047'],,Figure 8: Illinois River Barge Freight Rate,,,['005:45'],"{'hasEmail': 'mailto:pierre.bahizi@ams.usda.gov', '@type': 'vcard:Contact', 'fn': 'Pierre Bahizi'}",public,"{'@type': 'org:Organization', 'name': 'Agricultural Marketing Service, Department of Agriculture'}","['barge', 'carload', 'domestic', 'export', 'fuel surcharge', 'grain', 'grain inspections', 'international', 'ocean freight', 'ocean vessel', 'port region', 'railcar auction', 'railroad', 'shipment', 'shuttle train', 'truck', 'unit train']",https://creativecommons.org/licenses/by/4.0,,2014-12-23,R/P1W,,"[{'downloadURL': 'http://www.ams.usda.gov/sites/default/files/media/New%20Figure8_Bargrate.xlsx', 'mediaType': 'application/xls', '@type': 'dcat:Distribution', 'title': 'Excel Document'}]",USDA-5237
2012-02-29,,,['http://www.usda.gov/maps/html/kyfglossary.htm'],,"Know Your Farmer, Know Your Food Projects",,United States,['005:047'],,This dataset reflects USDA funded projects to develop local and regional food systems. It includes data from virtually all USDA Agencies and 9 other Federal Departments.,,,['005:45'],"{'hasEmail': 'mailto:elanor.starmer@osec.usda.gov', '@type': 'vcard:Contact', 'fn': 'Elanor Starmer'}",public,"{'@type': 'org:Organization', 'name': 'Agricultural Marketing Service, Department of Agriculture'}","['Federal-State Marketing Improvement Program', 'careers', 'farmers market promotion program', 'food hubs', 'healthy food access', 'know your farmer', 'local food', 'local meat', 'regional food systems', 'specialty Crop Block Grant']",https://creativecommons.org/licenses/by/4.0,,2014-12-23,R/P2Y,,"[{'downloadURL': 'http://www.usda.gov/maps/resources/KYF3Data/$file/kyfprojects.xls', 'mediaType': 'application/xls', '@type': 'dcat:Distribution', 'title': 'Web Page'}]",USDA-29911
