issued,describedByType,systemOfRecords,references,landingPage,title,theme,spatial,programCode,describedBy,description,language,isPartOf,bureauCode,contactPoint,accessLevel,publisher,keyword,license,rights,modified,accrualPeriodicity,dataQuality,distribution,identifier,,,,,"National School Lunch Program: State Implementation Progress, School Year 2012–2013: Report to Congress",,United States,['005:056'],,"This report responds to the requirement of Public Law 110-246 to assess the effectiveness of State and local efforts to directly certify children for free school meals. Direct certification is a process conducted by the States and by local educational agencies (LEAs) to certify eligible children for free meals without the need for household applications. States and LEAs directly certified 12.3 million children at the start of SY 2012-2013, an increase of 740,000, or 6 percent, from the previous school year. Over the same period, the population of school-age SNAP participant children increased by just 1.5 percent. As a result, the share of SNAP participant children certified for free school meals without application increased to 89 percent in SY 2012-2013, up from 86 percent in SY 2011-2012.",,,['005:84'],"{'hasEmail': 'mailto:Kevin.Russ@fns.usda.gov', '@type': 'vcard:Contact', 'fn': 'Kevin Russ'}",public,"{'@type': 'org:Organization', 'name': 'Food and Nutrition Service'}","['Children', 'SNAP', 'States', 'free meals', 'school']",https://creativecommons.org/publicdomain/zero/1.0/,Public,2013-06-12,,True,"[{'downloadURL': 'http://www.fns.usda.gov/direct-certification-national-school-lunch-program-state-implementation-progress-school-year-2012', 'mediaType': 'text/html', '@type': 'dcat:Distribution', 'title': 'National School Lunch Program: State Implementation Progress, School Year 2012\xe2\x80\x932013: Report to Congress'}]",USDA-FNS-33
,,,,,National and State Level Estimates of Special SNP for WIC Eligibles and Program Reach,,United States,['005:054'],,"This report offers updated estimates of the number of people eligible for WIC benefits in 2011, including (1) estimates by participant category (including children by single year of age) and coverage rates; (2) updated estimates in U.S. territories; and (3) confidence intervals. The national estimates presented in this report are based on a methodology developed in 2003 by the Committee on National Statistics of the National Research Council (CNSTAT). The report’s State-level estimates use a methodology developed by the Urban Institute that apportions the national figures using data from the American Community Survey",,,['005:84'],"{'hasEmail': 'mailto:Kevin.Russ@fns.usda.gov', '@type': 'vcard:Contact', 'fn': 'Kevin Russ'}",public,"{'@type': 'org:Organization', 'name': 'Food and Nutrition Service'}","['FNS', 'WIC', 'children', 'infant', 'women']",https://creativecommons.org/publicdomain/zero/1.0/,Public,2014-03-15,,True,"[{'downloadURL': 'http://www.fns.usda.gov/sites/default/files/WICEligibles2011Volume1.pdf', 'mediaType': 'application/pdf', '@type': 'dcat:Distribution', 'title': 'National and State-Level Estimates of Special Supplemental Nutrition Program for Women, Infants, and Children (WIC) Eligibles and Program Reach, 2011'}]",USDA-FNS-47
,,,,,New Local Educational Agency Second Review of Applications Report,,United States,['005:054'],,This memorandum provides information on the release of the new form used to report the results of the second review of free and reduced price applications in the National School Lunch Program (NSLP) and School Breakfast Program (SBP).,,,['005:84'],"{'hasEmail': 'mailto:Kevin.Russ@fns.usda.gov', '@type': 'vcard:Contact', 'fn': 'Kevin Russ'}",public,"{'@type': 'org:Organization', 'name': 'Food and Nutrition Service'}","['FNS', 'NSLP', 'SBP']",https://creativecommons.org/publicdomain/zero/1.0/,Public,2014-09-08,,True,"[{'downloadURL': 'http://www.fns.usda.gov/sites/default/files/SP62-2014os.pdf', 'mediaType': 'application/pdf', '@type': 'dcat:Distribution', 'title': 'New Local Educational Agency Second Review of Applications Report'}]",USDA-FNS-75
,,,,,Nutrient and MyPyramid Analysis of USDA Foods in Five of Its Food and Nutrition Programs,,,['005:055'],,"Through its food distribution programs, USDA purchases a variety of food including fruits, vegetables, meat, grains, and dairy products to be distributed directly to needy households or for use in congregate feeding programs that help Americans obtain access to nutritious food and support American agriculture. This report contains nutrient and food group analyses of the USDA Food distributed through NSLP, CACFP, CSFP, FDPIR, and TEFAP in fiscal year 2009.",,,['005:84'],"{'hasEmail': 'mailto:Kevin.Russ@fns.usda.gov', '@type': 'vcard:Contact', 'fn': 'Kevin Russ'}",public,"{'@type': 'org:Organization', 'name': 'Food and Nutrition Service'}","['CACFP', 'CSFP', 'FDPIR', 'FNS', 'Food Distribution Programs', 'NSLP', 'USDA']",https://creativecommons.org/publicdomain/zero/1.0/,Public,2012-01-15,,True,"[{'description': 'Nutrient and MyPyramid Analysis of USDA Foods in Five of Its Food and Nutrition Programs', 'format': 'PDF', 'title': 'Nutrient and MyPyramid Analysis of USDA Foods in Five of Its Food and Nutrition Programs', 'mediaType': 'application/pdf', 'downloadURL': 'http://www.fns.usda.gov/sites/default/files/NutrientMyPyramid.pdf', '@type': 'dcat:Distribution'}]",USDA-FNS-82
,,,,,Nutrition Assistance Programs Performance Report,,,['005:055'],,This report provides data regarding the nutrition assistance programs performance report for August 2014.  The report reflects the participation of persons in FNS' programs.,,,['005:84'],"{'hasEmail': 'mailto:Kevin.Russ@fns.usda.gov', '@type': 'vcard:Contact', 'fn': 'Kevin Russ'}",public,"{'@type': 'org:Organization', 'name': 'Food and Nutrition Service'}","['FNS', 'FNS Programs', 'Nutrition Assistance Performance Report', 'Participation']",https://creativecommons.org/publicdomain/zero/1.0/,Public,2014-09-05,,True,"[{'description': 'Nutrition Assistance Programs Performance Report', 'format': 'PDF', 'title': 'Nutrition Assistance Programs Performance Report', 'mediaType': 'application/pdf', 'downloadURL': 'http://www.fns.usda.gov/sites/default/files/datastatistics/June-Performance-Report-2014.pdf', '@type': 'dcat:Distribution'}]",USDA-FNS-80
,,,,,Nutrition Assistance in Farmers Markets: Understanding the Shopping Patterns of SNAP Participants,,,['005:056'],,"This study was undertaken to understand why some SNAP participants shop at farmers markets and others in the same geographic area do not.  Results suggest that SNAP participants buy most of their fresh fruits and vegetables at farmers markets.  Of those who shop at farmers markets, overall value including quality and price are major reasons for shopping at markets.  Of those who do not, reasons for not shopping at farmers markets centered on convenience.",,,['005:84'],"{'hasEmail': 'mailto:Kevin.Russ@fns.usda.gov', '@type': 'vcard:Contact', 'fn': 'Kevin Russ'}",public,"{'@type': 'org:Organization', 'name': 'Food and Nutrition Service'}","['Farmers Markets', 'Food and Nutrition Service', 'Fruits and Vegetables', 'SNAP', 'Shopping']",https://creativecommons.org/publicdomain/zero/1.0/,Public,2014-10-24,,True,"[{'accessURL': 'http://www.fns.usda.gov/sites/default/files/FarmersMarkets-Shopping-Patterns.pdf', 'format': 'PDF', '@type': 'dcat:Distribution', 'title': 'Nutrition Assistance in Farmers Markets: Understanding the Shopping Patterns of SNAP Participants'}]",USDA-FNS-88
,,,,,"Official USDA Food Plans: Cost of Food at Home at Four Levels, U.S. Average, July 2014",,United States,['005:057'],,"The Food Plans represent a nutritious diet at four different cost levels: thrifty plan, low-cost plan, moderate-cost plan, and a liberal plan.  The report is based on the costs of home-prepared meals and snacks.",,,['005:84'],"{'hasEmail': 'mailto:Kevin.Russ@fns.usda.gov', '@type': 'vcard:Contact', 'fn': 'Kevin Russ'}",public,"{'@type': 'org:Organization', 'name': 'Food and Nutrition Service'}","['Diet', 'Food Plans', 'Liberal Plan', 'Low-Cost Plan', 'Meals', 'Moderate-Cost-Plan', 'Nutritious', 'Snacks', 'Thrifty Plan']",https://creativecommons.org/publicdomain/zero/1.0/,Public,2014-08-17,,True,"[{'downloadURL': 'http://www.cnpp.usda.gov/sites/default/files/usda_food_plans_cost_of_food/CostofFoodJul2014.pdf', 'mediaType': 'application/pdf', '@type': 'dcat:Distribution', 'title': 'Official USDA Food Plans: Cost of Food at Home at Four Levels, U.S. Average, July 2014'}]",USDA-FNS-65
,,,,,Policy on Certification Periods for Zero Income Households,,,['005:055'],,"This memorandum provides revised policy guidance on certification periods pertaining to zero income households in FDPIR.  The revised policy for zero income households provides for certification staff to continue to question and document households that report zero income.  The certification periods have been revised to allow for longer certification periods, if the zero income household is verified to be stable with regard to lack of income.",,,['005:84'],"{'hasEmail': 'mailto:Kevin.Russ@fns.usda.gov', '@type': 'vcard:Contact', 'fn': 'Kevin Russ'}",public,"{'@type': 'org:Organization', 'name': 'Food and Nutrition Service'}","['Certification Period', 'FDPIR', 'FNS', 'Income', 'Policy', 'Zero Income housefold']",https://creativecommons.org/publicdomain/zero/1.0/,Public,2014-05-13,,True,"[{'description': 'Policy on Certification Periods for Zero Income Households', 'format': 'PDF', 'title': 'Policy on Certification Periods for Zero Income Households', 'mediaType': 'application/pdf', 'downloadURL': 'http://www.fns.usda.gov/sites/default/files/pmfd135_Revised_PolicyonCertificationPeriodsforZeroIncomeHouseholds.pdf', '@type': 'dcat:Distribution'}]",USDA-FNS-79
,,,,,Program Integrity for Nutrition Assistance Programs,,United States,['005:056'],,"Improving stewardship of Federal money by reducing recipient fraud, reducing retailer fraud, ensuring accurate eligibility determinations, and reducing improper payments.
Click on any state to Report Nutrition Assistance Fraud in that location.",,,['005:84'],"{'hasEmail': 'mailto:Kevin.Russ@fns.usda.gov', '@type': 'vcard:Contact', 'fn': 'Kevin Russ'}",public,"{'@type': 'org:Organization', 'name': 'Food and Nutrition Service'}","['Federal', 'civil money penalties', 'fraud', 'retailer']",https://creativecommons.org/publicdomain/zero/1.0/,Public,2014-07-25,,,"[{'downloadURL': 'http://www.fns.usda.gov/program-integrity', 'mediaType': 'text/html', '@type': 'dcat:Distribution', 'title': 'Program Integrity for Nutrition Assistance Programs'}]",USDA-FNS-18
,,,,,Reaching Those in Need: State SNAP Participation Rates for 2011,,,['005:056'],,This brochure provides a graphical representation of State SNAP participation rates for 2011.,,,['005:84'],"{'hasEmail': 'mailto:Kevin.Russ@fns.usda.gov', '@type': 'vcard:Contact', 'fn': 'Kevin Russ'}",public,"{'@type': 'org:Organization', 'name': 'Food and Nutrition Service'}","['FNS', 'Participation Rates', 'SNAP', 'State']",https://creativecommons.org/publicdomain/zero/1.0/,Public,2014-02-12,,True,"[{'downloadURL': 'http://www.fns.usda.gov/sites/default/files/Reaching2011.pdf', 'mediaType': 'application/pdf', '@type': 'dcat:Distribution', 'title': 'Reaching Those in Need: SNAP Participation Rates for 2011'}]",USDA-FNS-43
,,,,,Regional Office Review of Applications (RORA) for School Meals 2013,,United States,['005:054'],,This study is a summarization of the national estimates of administrative error in eligibility determinations and benefits issuance for free or reduced-price school meals.,,,['005:84'],"{'hasEmail': 'mailto:Kevin.Russ@fns.usda.gov', '@type': 'vcard:Contact', 'fn': 'Kevin Russ'}",public,"{'@type': 'org:Organization', 'name': 'Food and Nutrition Service'}","['FNS', 'Meals', 'School', 'benefits', 'eligibility']",https://creativecommons.org/publicdomain/zero/1.0/,Public,2014-08-17,,True,"[{'downloadURL': 'http://www.fns.usda.gov/sites/default/files/ops/RORA2013.pdf', 'mediaType': 'application/pdf', '@type': 'dcat:Distribution', 'title': 'Regional Office Review of Applications (RORA) for School Meals 2013'}]",USDA-FNS-77
,,,,,Report on the Summer Food for Children Demonstration Projects for Fiscal Year 2013,,United States,['005:055'],,"This Congressional report summarizes the implementation and evaluation of two approaches tested in the summers of 2011 through 2013. Summer EBT for Children (SEBTC) uses existing electronic benefits transfer systems to provide household benefits for children.  The Enhanced Summer Food Service Program (eSFSP) tests several changes to the traditional program, including incentives to extend operating periods, incentives to add enrichment activities, meal delivery for children in rural areas, and weekend and holiday backpacks.",,,['005:84'],"{'hasEmail': 'mailto:Kevin.Russ@fns.usda.gov', '@type': 'vcard:Contact', 'fn': 'Kevin Russ'}",public,"{'@type': 'org:Organization', 'name': 'Food and Nutrition Service'}","['EBT', 'FNS', 'children', 'eSFSP', 'electronic benefits', 'household benefits', 'rural areas']",https://creativecommons.org/publicdomain/zero/1.0/,Public,2013-12-21,,True,"[{'downloadURL': 'http://www.fns.usda.gov/sites/default/files/SEBTC_2013.pdf', 'mediaType': 'application/pdf', '@type': 'dcat:Distribution', 'title': 'Report on the Summer Food for Children Demonstration Projects for Fiscal Year 2013'}]",USDA-FNS-60
,,,,,"SNAP Activity Report, Error Rates and Quality Control",,United States,['005:056'],,"This webpage provides reports for SNAP activity, error rates and quality control.",,,['005:84'],"{'hasEmail': 'mailto:Kevin.Russ@fns.usda.gov', '@type': 'vcard:Contact', 'fn': 'Kevin Russ'}",public,"{'@type': 'org:Organization', 'name': 'Food and Nutrition Service'}","['ADA Status Reports', 'Activity', 'Cotton Quality', 'Error', 'Rates', 'SNAP']",https://creativecommons.org/publicdomain/zero/1.0/,Public,2014-07-25,,,"[{'accessURL': 'http://www.fns.usda.gov/pd/SNAPmain.htm', '@type': 'dcat:Distribution', 'title': 'SNAP Activity Report, Error Rates and Quality Control'}]",USDA-FNS-76
,,,,,SNAP Community Characteristics,,United States,['005:056'],,Data about communities and  SNAP households. Click on a State to find data by congressional district.,,,['005:84'],"{'hasEmail': 'mailto:Kevin.Russ@fns.usda.gov', '@type': 'vcard:Contact', 'fn': 'Kevin Russ'}",public,"{'@type': 'org:Organization', 'name': 'Food and Nutrition Service'}","['SNAP', 'and household relationships', 'data']",https://creativecommons.org/publicdomain/zero/1.0/,Public,2015-03-19,,True,"[{'downloadURL': 'http://www.fns.usda.gov/ops/snap-community-characteristics', 'mediaType': 'application/pdf', '@type': 'dcat:Distribution', 'title': 'SNAP Community Characteristics'}]",USDA-FNS-17
,,,,,SNAP EBT Third Party Processor (TPP)List and Guidance to Retailers,,United States,['005:056'],,"The list below provides Third Party Processor options for SNAP ‐ authorized retailers who may not know where to obtain EBT equipment and services. All SNAP ‐ authorized retailers, except those exempted below, must pay for their own EBT equipment and services and should arrange for lease or purchase of EBT equipment and services as soon as they can, in order to ensure future participation in SNAP",,,['005:84'],"{'hasEmail': 'mailto:Kevin.Russ@fns.usda.gov', '@type': 'vcard:Contact', 'fn': 'Kevin Russ'}",public,"{'@type': 'org:Organization', 'name': 'Food and Nutrition Service'}","['EBT', 'Equipment', 'Participation', 'Retailers', 'SNAP']",https://creativecommons.org/publicdomain/zero/1.0/,Public,2014-10-17,,True,"[{'downloadURL': 'http://www.fns.usda.gov/sites/default/files/snap/SNAP-EBT-Third-Party-Processor-List.pdf', 'mediaType': 'application/pdf', '@type': 'dcat:Distribution', 'title': 'SNAP EBT Third Party Processor (TPP)List and Guidance to Retailers'}]",USDA-FNS-63
,,,,,SNAP Employment and Training Resources,,United States,['005:056'],,This data set provides resources for state employment and training throughout United States.,,,['005:84'],"{'hasEmail': 'mailto:Kevin.Russ@fns.usda.gov', '@type': 'vcard:Contact', 'fn': 'Kevin Russ'}",public,"{'@type': 'org:Organization', 'name': 'Food and Nutrition Service'}","['employment', 'state', 'training']",https://creativecommons.org/publicdomain/zero/1.0/,Public,2014-05-22,,,"[{'downloadURL': 'http://www.fns.usda.gov/state-employment-and-training-resources', 'mediaType': 'text/html', '@type': 'dcat:Distribution', 'title': 'SNAP Employment and Training Resources'}]",USDA-FNS-20
,,,,,SNAP Online State EBT Access dataset,,United States,['005:056'],,"Provides the list of States that have online access to individual EBT (Electronic Benefits Transfer) account information for the Supplemental Nutrition Assistance Program (SNAP), such as balance and transaction history information.",,,['005:84'],"{'hasEmail': 'mailto:Ronald.Ward@fns.usda.gov', '@type': 'vcard:Contact', 'fn': 'Ronald Ward'}",public,"{'@type': 'org:Organization', 'name': 'Food and Nutrition Service, Department of Agriculture'}","['EBT', 'SNAP', 'States', 'Supplemental Nutrition Assistance Program', 'access', 'accounts', 'balance', 'electronic benefits transfer', 'food stamp program', 'information', 'online', 'transaction']",https://creativecommons.org/licenses/by/4.0,,2014-12-23,irregular,,"[{'downloadURL': 'http://www.fns.usda.gov/sites/default/files/SNAP_Online_State_EBT_Accounts.xlsx', 'mediaType': 'application/xls', '@type': 'dcat:Distribution', 'title': 'Excel Document'}]",USDA-FNS-00003
,,,,,SNAP Retail Locator,,United States,['005:056'],,"The Supplemental Nutrition Assistance Program (SNAP) Retailer Locator is designed to help recipients find SNAP local stores that welcome SNAP benefits.   The tool is intended to offer assistance to program recipients, State eligibility workers, community organizations - such as food banks - and others providing assistance to those in need.  SNAP Retail Locator tool will make it easier for SNAP participants, especially those who may be new and unfamiliar with the program, to gain access to food. The locator is available at http://www.fns.usda.gov/snap/retailerlocator.htm",,,['005:84'],"{'hasEmail': 'mailto:Jonathan.Benett@fns.usda.gov', '@type': 'vcard:Contact', 'fn': 'Jonathan Benett'}",public,"{'@type': 'org:Organization', 'name': 'Food and Nutrition Service, Department of Agriculture'}","['Assistance', 'Eligibility', 'Nutrition', 'Recipients', 'Retailer', 'SNAP', 'State', 'Stores', 'Supplemental', 'food', 'program', 'state']",https://creativecommons.org/licenses/by/4.0,,2014-04-30,R/PT1S,,"[{'downloadURL': 'http://www.snapretailerlocator.com/ArcGIS/rest/services', 'mediaType': 'text/csv', '@type': 'dcat:Distribution', 'title': 'Comma Seperated Values File'}, {'accessURL': 'http://www.snapretailerlocator.com/', '@type': 'dcat:Distribution', 'title': 'Web Page'}, {'accessURL': 'http://www.fns.usda.gov/snap/retailerlocator', 'format': 'API', '@type': 'dcat:Distribution', 'title': 'SNAP Retailer Locator'}]",USDA-FNS-000011
,,,,,SNAP Retailer Management 2013 Annual Report,,United States,['005:056'],,"This report details the responsibilities, authorization activities, and oversight findings that the Regional Operations Division (ROD) staff found regarding retailers who participate in the Supplemental Nutrition Assistance Program (SNAP).  ROD staff performed front-end authorization, reauthorization, maintenance, and administration related to retailer participation, administrative sanction activities, and retailer investigations in coordination with compliance partners.",,,['005:84'],"{'hasEmail': 'mailto:Kevin.Russ@fns.usda.gov', '@type': 'vcard:Contact', 'fn': 'Kevin Russ'}",public,"{'@type': 'org:Organization', 'name': 'Food and Nutrition Service'}","['Administrative', 'Participation', 'Regional Operations Division', 'Retailer Investigations', 'SNAP']",https://creativecommons.org/publicdomain/zero/1.0/,Public,2014-03-14,,True,"[{'downloadURL': 'http://www.fns.usda.gov/sites/default/files/snap/2013-annual-report.pdf', 'mediaType': 'application/pdf', '@type': 'dcat:Distribution', 'title': 'SNAP Retailer Management 2013 Annual Report'}]",USDA-FNS-62
,,,,,School Breakfast Participation and Meals Served Data,,United States,['005:054'],,"The School Breakfast Program (SBP) provides cash assistance to States to operate nonprofit breakfast programs in schools and residential childcare institutions.   Data here consists of participation, breakfast meals served, and cash provided to states, all by year, month and current.",,,['005:84'],"{'hasEmail': 'mailto:Kevin.Russ@fns.usda.gov', '@type': 'vcard:Contact', 'fn': 'Kevin Russ'}",public,"{'@type': 'org:Organization', 'name': 'Food and Nutrition Service, Department of Agriculture'}","['Breakfast', 'Participation', 'Program', 'School', 'States', 'assistance', 'cash', 'childcare', 'meals']",https://creativecommons.org/publicdomain/zero/1.0/,,2014-02-24,R/P3M,,"[{'downloadURL': 'http://www.fns.usda.gov/sites/default/files/pd/sbsummar.xls', 'mediaType': 'application/xls', '@type': 'dcat:Distribution', 'title': 'School Breakfast Participation and Meals Served Data'}]",USDA-FNS-00004
,,,,,School Food Authorities (SFAs) Purchasing Produce from U.S. Department of Defense (DoD) Vendors using Section 4 and 11 for Fresh Fruit and Vegetable Program (FFVP) Funds Memo,,,['005:054'],,This memorandum clarifies how SFAs may use funds provided under Sections 4 and 11 or 19 of the National School Lunch Act (NSLA) to purchase fresh fruits and vegetables from DoD Fresh Fruit and Vegetable Program (DoD) vendors.,,,['005:84'],"{'hasEmail': 'mailto:Kevin.Russ@fns.usda.gov', '@type': 'vcard:Contact', 'fn': 'Kevin Russ'}",public,"{'@type': 'org:Organization', 'name': 'Food and Nutrition Service'}","['DoD', 'FNS', 'Fresh Fruit and Vegetable Program', 'Memorandum', 'National School Lunch Act', 'SFAs']",https://creativecommons.org/publicdomain/zero/1.0/,Public,2014-03-06,,True,"[{'description': 'School Food Authorities (SFAs) Purchasing Produce from U.S. Department of Defense (DoD) Vendors using Section 4 and 11 for Fresh Fruit and Vegetable Program (FFVP) Funds Memo', 'format': 'PDF', 'title': 'School Food Authorities (SFAs) Purchasing Produce from U.S. Department of Defense (DoD) Vendors using Section 4 and 11 for Fresh Fruit and Vegetable Program (FFVP) Funds Memo', 'mediaType': 'application/pdf', 'downloadURL': 'http://www.fns.usda.gov/sites/default/files/pmfd133_SFAsPurchasingProducefromDoDVendorsUsingSect4and11orFFVPFunds.pdf', '@type': 'dcat:Distribution'}]",USDA-FNS-84
,,,,,School Foodservice Indirect Cost Study,,United States,['005:055'],,"The Healthy, Hunger-Free Kids Act (HHFKA) directed USDA to study the extent to which school food authorities (SFAs) participating in the National School Lunch Program (NSLP) and School Breakfast Program (SBP) pay indirect costs to local education agencies (LEAs). It specifically requested an assessment of the methodologies used to establish indirect costs, the types and amounts of indirect costs that are charged and not charged to the school food service account, and the types and amounts of indirect costs recovered by LEAs. To address the research questions, information was collected from four perspectives: (1) the State education agency finance officer, (2) the State child nutrition director, (3) the LEA business manager, and (4) the SFA director.",,,['005:84'],"{'hasEmail': 'mailto:Kevin.Russ@fns.usda.gov', '@type': 'vcard:Contact', 'fn': 'Kevin Russ'}",public,"{'@type': 'org:Organization', 'name': 'Food and Nutrition Service'}","['FNS', 'HHFKA', 'LEAs', 'NSLP', 'SBP', 'SFAs', 'indirect costs']",https://creativecommons.org/publicdomain/zero/1.0/,Public,2014-03-11,,True,"[{'downloadURL': 'http://www.fns.usda.gov/sites/default/files/SFICS.pdf', 'mediaType': 'application/pdf', '@type': 'dcat:Distribution', 'title': 'School Foodservice Indirect Cost Study'}]",USDA-FNS-61
,,,,,Smart Snacks Standards for Exempt Foods when Paired Together Notice,,United States,['005:054'],,"The Healthy, Hunger-Free Kids Act of 2010 (HHFKA) directed the Department of Agriculture (USDA) to establish nutrition standards for all foods and beverages sold to students on the school campus during the school day.  On June 28, 2013, the Food and Nutrition Service (FNS) published the ""Smart Snacks in School"" (Smart Snacks) regulation that carefully balances science-based nutrition standards with practical and flexible solutions to promote healthier eating on campus.  The purpose of this memorandum is to clarify Smart Snacks standards for exempt food that are paired together as a single snack.",,,['005:84'],"{'hasEmail': 'mailto:Kevin.Russ@fns.usda.gov', '@type': 'vcard:Contact', 'fn': 'Kevin Russ'}",public,"{'@type': 'org:Organization', 'name': 'Food and Nutrition Service'}","['Beverages', 'FNS', 'Foods', 'HHFKA', 'Nutrition', 'School', 'Students']",https://creativecommons.org/publicdomain/zero/1.0/,Public,2014-09-11,,True,"[{'downloadURL': 'http://www.fns.usda.gov/sites/default/files/cnd/SP63-2014os.pdf', 'mediaType': 'application/pdf', '@type': 'dcat:Distribution', 'title': 'Smart Snacks Standards for Exempt Foods when Paired Together Notice'}]",USDA-FNS-74
